reviewId,userName,userImage,content,score,thumbsUpCount,reviewCreatedVersion,at,replyContent,repliedAt,appVersion
91da67bf-99b0-461b-986e-88e053f9e596,L L,https://play-lh.googleusercontent.com/a/ACg8ocLClVEheSXbd6Zj3jJu89-CC9WLK5wSe9lscCYfMSFs=mo,"please fix the big mistake you made. By putting the navigation bar on the side instead of the bottom. this is ridiculous. Why would you make it different than a phone version and a desktop version? please fix this mistake. one star. thanks , now I'm done with using Instagram on my tablet! I'll keep it at one star until you move the navigation bar back. ugh!",1,162,313.0.0.26.328,2024-01-11 11:17:34,,,313.0.0.26.328
e90850f8-acb5-4a51-8e32-624285ca4187,Brooke Black,https://play-lh.googleusercontent.com/a/ACg8ocKFODptKyVQwm6EMvXbZJaviKBF4Qz5T518f6FKa2TZ=mo,"I've been having the same issue for months, I'm trying to change my name and insta just freezes or crashes when I click to change it. I've sent multiple reports with no word back. I've Google how to fix it and nothings working. No body has helped me and the review I've left before got no attention either. Frustrating stuff.",1,3,313.0.0.26.328,2024-01-15 06:08:03,,,313.0.0.26.328
3b1f89ad-c1bc-4735-9ea2-52421d3cd21a,Никита Мясников,https://play-lh.googleusercontent.com/a-/ALV-UjU9sVmHo4IPmBmbHa6XeUmZ8uoWgT2KeyNGHT3eUQnqqg,"It's a disgusting app, starting with the fact that it's just pointless and stupid in its essence, ending with an uncomfortable interface and constant account verification, where there are no photos, but you are asked not only to confirm your phone number with email, but also to take a video of yourself to ""confirm that I am a living person"". What is this, where is user privacy?",1,9,312.1.0.34.111,2024-01-07 16:57:52,,,312.1.0.34.111
9937d519-31e8-4324-90c8-7805fc80fd31,Amira Nasr,https://play-lh.googleusercontent.com/a-/ALV-UjVQXvg1sY6rIqO6MN6V5kfeYtKhw0GakejRgVURmwsj2WGa,I've had no issues with Instagram all these years but it's been a few days now and my Instagram has been glitchy. I would get a flood of past notifications even though I have already opened them but they keep popping up in a wave of notifications. I tried reinstalling and googling but nothing helped. Kind of getting sick of this. Ps. It's not the same case with my other phone.,4,611,309.1.0.41.113,2023-12-06 18:26:12,,,309.1.0.41.113
d0c12bd6-2572-4bf1-ba7b-62e95e024110,Aatish Bagal,https://play-lh.googleusercontent.com/a/ACg8ocLHGgojUHTxBhiFKZkWNPVy0LBccRl79dE-tyzSO3YucQ=mo,"Unusably unstable app, feed just refuses to load sometimes. Every account and phone has a different set of features (even interactive features like notes), some reels have progress bar some don't. While watching reels, video brightness randomly increases to max (Its just the video not the UI) and some videos are stretched vertically. Randomly blackscreens while watching stories (Goes back to normal when you exit stories). All of this is on stable versions. Reinstalling doesn't work either.",1,5159,309.1.0.41.113,2023-12-06 11:25:24,,,309.1.0.41.113
a0b6233d-21f2-4f66-b53c-467170aa5eb8,g Hs,https://play-lh.googleusercontent.com/a-/ALV-UjUvmMDbJBIaDEkugYOKS_iAXU4bEecyk9Vp3X2lgC4yv6kQ,Bugs? Two days I've not been able to upload from my sd card. Seen many having the same issue. Only access to internal storage albums. Preventing me from using Instagram properly. Very frustrating Prior to this I was able to use it fine and upload from any album. No way of communicating with instagram when you need help,1,4,313.0.0.26.328,2024-01-15 18:58:52,,,313.0.0.26.328
ba965bd4-5039-47de-8b99-f0c10cee91eb,Phelo Jokana,https://play-lh.googleusercontent.com/a-/ALV-UjUD_mBQ2UDLZEJBYcFVcvxVybIW5C72CR_WlI128KWkazA,"I've been using Insta for a long time and I haven't faced any issues... but this update is THEE worst update. I've been facing issues with the story feature. When I post a pic on my story: I can't add a filter on the pic, i can't add text, i can't tag someone, i can't add music. When I do those things it automatically says 'Error'. It only works when I just post the pic and add no filter, no text, no music and don't tag anyone. PLEASE FIX THIS IG.",1,74,313.0.0.26.328,2024-01-12 15:21:47,,,313.0.0.26.328
b7aec8f9-b193-43e3-a4e1-f3d83f1a7298,Eve Tickner,https://play-lh.googleusercontent.com/a-/ALV-UjW7awRD-0K_dfXInOcySewJNnQ5duTDGIIPIXgK4bSOvm0,Awful. I've reported issues 4 times and never received any feedback or response and issues still aren't fixed. Everytime I watch reels my instagram malfunctions and won't let me tap the screen or read comments or like anything unless I close the app and re open it. When I scroll to a different reel the comment pages from the previous reel appears for the one below it or anything else I watch. I can't update any stories to my highlights because they refuse to upload into my archive. Awful app,1,23,312.1.0.34.111,2023-12-24 14:35:56,,,312.1.0.34.111
0af52c90-e621-415c-beeb-e644d5a46cbf,Atanas Bozhkov,https://play-lh.googleusercontent.com/a-/ALV-UjWnNB6nKJkA630MjX5gZOkPBWLYOS1uZwEmC68h0PFd7Ts,Poor experience while creating Instagram reels and trying to play the current state of videos and editing the timeline. The preview don't always plays or the video playback lags.. when you play the final result it's ok but the preview screen is so much buggy on Pixel 8 Pro (not sure about other Android devices) and it's a shame. Please improve this experience.,2,9,312.1.0.34.111,2023-12-24 00:25:16,,,312.1.0.34.111
e60f5d6d-9f67-4294-8623-bdad4ad52d64,Archana Tiwari,https://play-lh.googleusercontent.com/a-/ALV-UjXWE6Lrtyjd297kFnsAhKREb4T2K35-IteG206l3bk_X40,"I've been using VN Video Editor for a while now, and it's become my go-to mobile video editing app. It's incredibly user-friendly, which is perfect for someone like me who doesn't have much experience with video editing. The trimming and merging features are straightforward to use, and I love how easy it is to add transitions, filters, and music to my videos. The selection of stickers and text options allows me to get creative and add a personal touch to my videos. I highly recommend it.",5,5026,309.0.0.40.113,2023-11-17 12:53:27,,,309.0.0.40.113
c381881e-31ae-4a65-a7ec-715fab9d0466,Justin Harkness,https://play-lh.googleusercontent.com/a-/ALV-UjX8ISmvLxonvTBbjy83cm4kEWmu7IDNGe9eAa3m41ZdSQ,"Apps are suppose to get better as time progresses through the years. Not Instagram tho. Every update that comes out, I've noticed the app gets worse, for example - slower, has more bugs, features that no longer work, terrible auto refresh, limiting how many people you can follow in a day, search bar doesn't relay even remotely what you searched, limiting how many followers you can gain in a day, & a complete lack of monitoring the community from posts that shouldn't be allowed on a Social plat.",1,3,312.1.0.34.111,2023-12-30 06:59:51,,,312.1.0.34.111
1c7905ad-163d-4fde-8451-ee638968b940,Chris T,https://play-lh.googleusercontent.com/a-/ALV-UjVvgGkb0plewA7m-AwBoMnSSHGswTwQJz8gw_hAm-ooTfo,Not optimized for Z Fold 5 since last update when you try to post pictures the aspect ratio is just a square and can no longer do widescreen option it just reverts to a square and the pictures are cut off. Not ideal but I have to uninstall the app every 2 days and reinstall it for it to work properly.,2,2,312.1.0.34.111,2024-01-07 03:28:02,,,312.1.0.34.111
07bd386c-8188-44df-92f2-4ac4f376199c,Stevie Yardy,https://play-lh.googleusercontent.com/a-/ALV-UjUDmkHpyCr_N1o6ATraPjH71EWkF9EAVRixGJeu6bhIiXFL,"When making reels, the items in the tracks in the editor disappear while the sticker/object remains essentially leaving you unable to make edits. All new stickers don't show up in the edit tab at all and even after clearing cache and restarting the app it persists. Happy to record my screen too to prove I'm not just using it incorrectly. Reel editor is full of glitches and missing features. Terrible for an app trying to complete with tiktok",1,86,309.1.0.41.113,2023-12-02 06:59:06,,,309.1.0.41.113
b2d50e97-d33a-4117-b587-caa729246f22,Sister Of Claudia,https://play-lh.googleusercontent.com/a/ACg8ocL-WDBzWcWO45s0sKAhghoByKR7FfdifKMoabAxTId7=mo,"I can't access the folders with pictures and videos that I made with my phone. Screenshots and downloaded items do appear and I can't seem to fix the issue (reinstalling app, clearing data, turning phone off, etc.). Please fix this, it makes the app unusable.",1,5,313.0.0.26.328,2024-01-12 16:57:45,,,313.0.0.26.328
4c757532-4c41-40b4-a3ff-3b8e41b1ec15,Mehvish Siddique,https://play-lh.googleusercontent.com/a-/ALV-UjUfOdOAqZry_i2xkcUTeH_1vMW2K5mWL8Oy1uwvpKiumLU,This is one of my fav app but I'm facing this issue alot lately if we add any audio from music feature to the stories and if the audio becomes unavailable the stories will become unavailable too. This is so annoying. Lots of important stories are just gone. Please do fix this already. If the audio is unavailable later the audio should be the only thing to get affected.,1,256,310.0.0.37.328,2023-12-14 17:04:48,,,310.0.0.37.328
8454fe37-47af-425e-9164-caabcf4f3717,Miguel Garcia,https://play-lh.googleusercontent.com/a/ACg8ocL5QBDv4hy4iYAEevZNSnDFjbcHAcsDqHKp62R3pAqH=mo,"Why did you started to refresh the timeline every time we get back to the main page?????? There are posts the user would like to continue seeing after exiting a comment view or profile. Why do you make a mess of things that work just fine???? Also, a video cover photo cannot be changed after publishing it. Your managers are making good decisions... (or not, as most of the time)",1,451,309.1.0.41.113,2023-11-30 04:41:39,,,309.1.0.41.113
791394b2-0a8d-4ec8-b43f-b73bd20a7249,Fay Thompson,https://play-lh.googleusercontent.com/a-/ALV-UjVyhK8C8JphAi9S1QI-xrRhHjQESHZUR383actpQa949P0,"Great, except when I tap to 'read more' on certain posts, I get a couple of pages worth of blank screen and the caption written by the poster won't show, but comments do. Happens all the time - so annoying and I can't see any update which might be needed in Google PlayStore.",3,2,312.1.0.34.111,2023-12-26 09:41:18,,,312.1.0.34.111
4167311e-1dc2-460e-bab9-c2dfe96af52d,Pushkar 2556,https://play-lh.googleusercontent.com/a-/ALV-UjWnkaV2egBylUDUM1JsTiNATGQ9x6V2agxrpnyw524bfN4,"Worst update ever. It stops working every time, I'm seeing the comment section of previous reel in the new one. Sometimes I can't tap to pause, mute, share and go to comments. It freezes everytime. The developers have no idea what they have to do. They are making the user experience as worse as they can. The interface while sharing is the worst, those big circles, you sometimes can't share while using your phone single handedly. I request Devs Please fix them and bring back the old share button.",2,2,312.1.0.34.111,2023-12-27 17:37:20,,,312.1.0.34.111
9ab83440-fb68-491f-bdbe-389f687b2cd9,Syed Dayim Shah,https://play-lh.googleusercontent.com/a-/ALV-UjVAsMzrc2okG9GLdOSZgEot3RoUVInPtsb1nj7Si9AYd7M,"I like Instagram, but I don't know what your developers get paid for. The Instagram is so buggy it annoys me to open it. Sometimes the the dark theme crashes and almost each icon has white theme the text disappears. (don't blame my phone, I am myself a software developer. I have 16 gigs of ram and Snapdragon 8 gen 2) Ok when I go to search bar and I click on some post I like and bamm the audio runs and but the post is blank then I have to swap the post and click on it again! Yes app is updated.",3,3,312.1.0.34.111,2024-01-07 22:12:55,,,312.1.0.34.111
b1916c59-d9e6-4543-b9c9-b08eb35a51de,Alexander Wells,https://play-lh.googleusercontent.com/a-/ALV-UjVBwfpLqXl10E-P3-mpjD8vVgtH6D2ZN6j882wVewG5dg6Q,"Ever since the latest update, when I open my photo library to make a post, it only shows one single photo folder, and won't access anything from my SD card storage. I really hope this issue can get fixed soon, as I use Instagram to advertise my art. The same happened with the threads app.",3,2,313.0.0.26.328,2024-01-14 08:56:50,,,313.0.0.26.328
35866bc8-d9f8-43a4-9c07-09cb761b26f1,toni mooreruck,https://play-lh.googleusercontent.com/a-/ALV-UjUy2Mho68iTAuQ0GiNmTZzJAEhpfTBxPU8bQjAVIN9aJY8,"Not bad, I prefer it to Facebook. Fb sucks now.. I dislike the new back to back ads. The algorithm narrows the variety of topics I used to see. Can be repetitive in certain topics ie. Quotes. When you start to follow someone new, your page is flooded with their content, missing other's posts... I avoid following people because of this issue.",4,9,312.1.0.34.111,2024-01-06 16:03:07,,,312.1.0.34.111
90f7513a-bda8-4b02-a6b8-00d06aa0fe2a,Nisha Das,https://play-lh.googleusercontent.com/a-/ALV-UjUPaPMjUx2KVEMIJcYzm0lvL9HAmbcC7l4lcV5xnWug2XE,"There are so many techinal issues and how much data it consumes.....Even before we are able to add any songs to our stories or reels or posts but now.....we can't even find a single song of our choice, so problematic this app is....day by day apps upgrade but Instagram is degrading only....Alas, thats why it's rating is degrading like the app itself.....",2,2,312.1.0.34.111,2024-01-07 13:56:18,,,312.1.0.34.111
94c5164c-5e09-4d23-9542-701dc84ecbb4,Ace Animations,https://play-lh.googleusercontent.com/a-/ALV-UjXLNvc6dxcyd9fWED3bRtU8o9lqWEq4N9qMVcu7lMcFgIg,"It's grand, but recently Instagram keeps duplicating my posts (downloading my photos I've just uploaded) EVEN though I have the save original post option off. I've checked if i need to update app, reported it as a bug, and it's STILL happening. It's not a big issue but it's annoying to constantly go back into my gallery and delete the duplicates",2,13,312.1.0.34.111,2024-01-09 05:38:00,,,312.1.0.34.111
46c232f0-f61a-4e82-a56c-e450062f87cb,Afnan Ranjha,https://play-lh.googleusercontent.com/a-/ALV-UjUR5ANpbjnzpBKJh5BidSJJHNeWdZx5a6M2tC5cIksFQw,"Worst experience ever after update. My DMS are not working . I read them still they come as unread and my messeges are not being sent to anyone . They just keep on sending and then nothing happens. Kindly resolve this dm issue . I have re-installed the app, clear cache and restart my device many times. Nothing works and its getting me frustrated....Solve that problem ..Please 🙏🙏🙏",1,3,312.1.0.34.111,2024-01-01 02:03:49,,,312.1.0.34.111
89dcb4b6-8b2d-41a8-be71-6a2c6d5f9fc3,Jenny P,https://play-lh.googleusercontent.com/a-/ALV-UjWHfqY-8qwx2MdVf0AFmbjoFbPMfKC7fYMiHFVSxzOEmw,"What happened? I assumed I needed to update or something, but it seems I'm not the only one who suddenly started having issues with multiple image posts, and the video editing is literally painful, then when you think you finally have it, IG moves the music or crashes. If tiktok can do it, why can't IG? And more than that, why is it WORSE than it used to be? Take it back a version, please 🥲",1,202,306.0.0.35.109,2023-10-29 03:34:11,,,306.0.0.35.109
e1f313e7-b53b-4db9-a530-9576ba36eb43,Anjali Munshi,https://play-lh.googleusercontent.com/a-/ALV-UjU8WDERnXdNC2WR71vbzP1724UMZwe86joMZ3EhGwkj-8M,Overall instagram is a very good social media platform but a glitch has been bothering me for a while. Instagram's new feature of adding music to multiple photo is really cool but i'm unable to add music to a post where there are multiple pictures or so. The option of add music doesn't appear. I've tried updating the app but that isn't helping. I've also tried doing it from my other account but the issues still remains! How can I have access to his new feature?,3,6789,309.0.0.40.113,2023-11-20 21:25:46,,,309.0.0.40.113
c9eafbf7-adb6-4b79-9449-a15c5f7ea67f,항숙대,https://play-lh.googleusercontent.com/a-/ALV-UjU0iMqkyNPb7t3lKt2Yh9yBmr2WyYSYjK7xptPnz8GDW-0,Unable to scroll through a story without it freezing solid. It randomly crashes at time where it's never been opened so how's it running in the background? The reels when clicking on one are extremely repetitive instead of loading new things. Fix your app. Now.,2,5,312.1.0.34.111,2024-01-03 09:07:36,,,312.1.0.34.111
320742b9-8e1f-4c94-bb88-4f259a95f578,Kasie Elardo,https://play-lh.googleusercontent.com/a/ACg8ocI9iNfwFaByaHqZTnnOjSrkEpaj2Pm9-gPciRdE2cbb=mo,"If I could give no stars, I would. Same Instagram account since 2018, I updated my password in June, my correct email and phone number are linked. Somehow, after I unexpectedly had to change devices, I can't get into my own account. It won't send me the email link to reset my password or the text message link to reset my password. I don't even have the option to log in with Facebook on the app, I tried via browser and it sends me into a loop! Three weeks of this, absolutely infuriating.",1,8,313.0.0.26.328,2024-01-13 02:27:52,,,313.0.0.26.328
df94b58e-a3ae-47a9-b032-0f3008ac2eb3,Stephanie Gobler,https://play-lh.googleusercontent.com/a-/ALV-UjVbGO9I9cGnN2jl1NwQdJUiLirra4pXHnfKScXlJCpXWz4,"Undo the latest update! Not showing all of my recent photos anymore when I go to create a post... it's like it no longer supports either HEIC images or my SD card, which worked perfectly until the latest update. My camera automatically saves to that format and location, so basically none of my photos are shareable on instagram anymore.",1,22,313.0.0.26.328,2024-01-13 11:58:44,,,313.0.0.26.328
3806ac6e-c234-4902-a51e-8e64ac58c889,Hautai Greensill,https://play-lh.googleusercontent.com/a-/ALV-UjWZgdcce-1rjl1RW060_qaiywzyX8Bu4jDL-uMZTk454g,"Keeps limiting my ability to comment, removes comments unnecessarily e.g. thanking the posters for their time and effort to share the content. I tried selecting the option that they got it wrong but, when I select the next button ""Tell us"" it shuts it down and goes back to the post. Also, cannot edit comments to correct errors e.g. if autocorrect changed something to make it wrong and the same for content on stories it would be great to be able to adjust the text. I will be uninstalling the app.",2,151,309.0.0.40.113,2023-11-26 18:54:00,,,309.0.0.40.113
b73d4614-65cb-4b2e-a80e-e32226bfe5ef,Aditi Panwar,https://play-lh.googleusercontent.com/a/ACg8ocKShqoZzCc8zoxBMHwPAQeXaumOyVKWRhIa2-uIGVqd=mo,"It does not have option to delete some selected messages sent from both side.......... If it would have this option it would be helpful in most cases and make some one comfort....... I hope that in new update you bring this option too......... It is the problem said by most of the people I know........ It is the best app for conversation , entertainment, but only the issue is of it can not select and delete messages from both of the side..... Bring this update as soon as possible.............",3,109,312.1.0.34.111,2024-01-04 23:34:14,,,312.1.0.34.111
84f37f0b-e1e1-4328-89cf-2b79dc377b68,Ethan Omer Fox,https://play-lh.googleusercontent.com/a-/ALV-UjW22yDbLn51g90a85sX6A3MbRDDXw8eqxIHqYpqCdCzEFI,"Comments take 40 minutes to load... On reel videos, the bottom 1/3rd part of the video is completely obscured by the video information that I can't dismiss. (the Name of the poster, Description, Song Name, etc, cannot minimize!!) Also posts don't show the date of posts anymore. Instead, it shows the number of ""weeks ago"" that photos/videos were posted.",1,472,313.0.0.26.328,2024-01-13 11:35:30,,,313.0.0.26.328
4edf2ed2-80e7-4b7d-a2d1-3e91b038f573,Lenn Dolling,https://play-lh.googleusercontent.com/a-/ALV-UjU-MXaGJ-2PsqSkR1bggV5KCKava3bpzlOUznks3jGyfUo,Video editor is getting better and better. Keep it up. .... Update... Full stop!!!! What a joke. I have 2gigs of videos on my phone and the video editor takes over 120 gigs of storage space to make a reel. Update: A manager needs to be given a pay bump for making things work again.,4,9,312.1.0.34.111,2024-01-02 10:12:56,,,312.1.0.34.111
431a16bf-37a0-4b3b-9e69-cfa43b9b005e,rvre gods,https://play-lh.googleusercontent.com/a-/ALV-UjWzvrnxUcuXJO8x4tBov9GGjwPf30LJS9Nhd3uwAg7-s8g,"Uploaded reels change exposure and a colour tint. Extremely frustrating issue, as I'm an artist and I want my video to look the way it was intented to look. At the beginning I thought that the bug, was related to boosting my reels, as all of the boosted reels changed the colours, and my privated videos (from a different account) remain the same. But today I decided to post on my public account without boosting and the colours still changed. Very disappointed. Fix your app lol",1,150,309.0.0.40.113,2023-11-18 03:55:49,,,309.0.0.40.113
fdad4172-1be7-4f6a-b4e5-2a692efa8fe9,Beyant Kaur,https://play-lh.googleusercontent.com/a/ACg8ocKyak6UHcqrwIKgeBpgl_BJvqa6OwpSyc8RGYs-_WbA=mo,"there is a very big problem that we are not able to find the accounts of our friends. When I entered my friends account on search tab then it shows no result. And secondly , when I tried to log in my account on other mobile . After filling all the necessary information. It shows that the username is not available. I thought the is in the servers which didn't update the information faster about an account. And shows a valid account as an invalid account.",3,91,312.1.0.34.111,2024-01-07 17:17:57,,,312.1.0.34.111
d65df119-2b9d-4f72-964b-208e1d0715ae,Taylor Fieseler,https://play-lh.googleusercontent.com/a-/ALV-UjWc5coOED4lOim-skJpxsv1AOcQ7Mv42kTXw29I7CRucb0,"Absolutely 💩! nothing but a wanna-be tiktok now. I've never had so many issues with this app over all the years I've used it. Can't even upload multiple photos without IG shrinking them, they don't boost anything other than reels (again, wanna-be tiktok). Someone needs to come out with a new app so I can delete IG after all",1,12,312.1.0.34.111,2024-01-07 00:17:12,,,312.1.0.34.111
5fe2b455-473b-4f47-983d-e34151a341ef,game Login,https://play-lh.googleusercontent.com/a/ACg8ocIJ3yIOCmmM5B3ZteMg1uACiIHBv2hcXM_iGlzYFJ5M=mo,"Instagram is my go-to platform for sharing and connecting. The user-friendly interface, creative tools, and diverse filters make every post an expression of my personality. The Explore feature keeps things exciting, introducing me to content that aligns with my interests. Regular updates show a commitment to improving the user experience. It's the perfect app for staying connected and expressing creativity. Five stars",5,105,312.1.0.34.111,2024-01-13 22:42:20,,,312.1.0.34.111
695fe13d-b1a7-47d3-b229-21ab51698b48,Sahil Bhoyar,https://play-lh.googleusercontent.com/a/ACg8ocJ1GTc1YeXFzcu9uhIfwyspIK_LteuBBrziQXWvUfLn=mo,"This is a very usefull app for me The videos do not have an instructor talking you through the workout, explaining good form or what muscles to target. They also don't give you any transition time between exercises. Also ever time I log into the app it asks me to make an in app purchase, which is very frustrating considering I already bought my program just to use the app at all. That being said, I'm going see how I feel about the actual workouts by the end of the month",5,67,312.1.0.34.111,2023-12-28 05:05:48,,,312.1.0.34.111
9f7f829d-fe86-47a9-ac7c-6b20f216e2bf,Fatima Yasir,https://play-lh.googleusercontent.com/a-/ALV-UjVTtznNHml65ubEtA-86eLFwWKdSS71loHc-kcJQFEqNzA,"I've been facing a issue lately that is some stories in my highlights aren't just showing up, it's just showing a try again arrow. It's been 4 months since this problem and with perfect network it's still not working and on some stories in the highlights in the background the music is not playing(saying it's unavailable although it was available at the time i put it on my story).",3,4487,308.0.0.36.109,2023-11-11 23:50:54,,,308.0.0.36.109
41dd151c-85e7-449a-8c08-4546460aa7cf,Leo Dee,https://play-lh.googleusercontent.com/a-/ALV-UjXAeTBKeFTwKj6sqp8nG4bSS2eFs3KD5vOVLNulp7T-vQ,"Not sure why thus happens every time I listen to a voice message in PM. When the message is over the phone shuts off. If I watch a reel and it's over the phone shuts off, when I wake it back up I lose my place and I go back to the top of the feed (refreshed). It extremely annoying!!!",2,4,312.1.0.34.111,2023-12-28 06:48:51,,,312.1.0.34.111
92675c88-2afa-498a-a531-a187e1a11ff6,Anya Ryabinina,https://play-lh.googleusercontent.com/a-/ALV-UjWVmSbJRysZo6fdQbXCKLOYVnr2A5kPu_m1tPYENoK-u1I,Instagram seems to have a bug today - can't post stories on my Huawei P20 Pro. When I choose a photo from library it shows up black. Or it just freezes my face on screen and as if tries to post it. App is uptodate. I'm based in Russia and insta works on vpn only. Tried both vps already. Nothing changes this. Never had this before. Whats going on Instagram? Help fix this please.,2,3,312.1.0.34.111,2024-01-07 02:52:23,,,312.1.0.34.111
061d41ea-fa5f-4664-bfa6-3f91cf4e030e,Kyle Macri,https://play-lh.googleusercontent.com/a-/ALV-UjXvpBwOtuTDKTlgrFxYCLE7nA82W5S5O9gqjPWwDuSV3Q,"Recently, on christmas. Got the account has been compromised knowing that it isnt,havent had suspicious emails or log ins .its been a few days. Fixed it one time. but it says its still is compromised, which is wrong. Ive done nothing wrong. Guess ill stay off for a week. Instagram update the app or comment so it doesnt do this. Would give a zero but i cant.",1,12,312.1.0.34.111,2023-12-27 22:54:48,,,312.1.0.34.111
bd376707-c5c8-4a26-ab72-9de3daef9f51,Aditeyo Ghosal,https://play-lh.googleusercontent.com/a/ACg8ocJCohtMgkJEZpQ4fKm_ojZLL_KbnGcRaOHs4G0yp1ax=mo,"I love to use this app. It's a good and safe and secure social media app developed by Meta. I think it's better the facebook. Instagram can be more updated. Instagram needs a bit of animation. But the app eats soo much space, it's 958 MB in my phone and the app is only like a 100 MB. I don't know about Instagram Lite, but I think it takes less space. But it's good.",4,3,312.1.0.34.111,2024-01-07 15:14:45,,,312.1.0.34.111
