reviewId,userName,userImage,content,score,thumbsUpCount,reviewCreatedVersion,at,replyContent,repliedAt,appVersion
7e3fb158-ad83-4dd1-9595-da7c398b16b1,Jasiya,https://play-lh.googleusercontent.com/a-/ALV-UjUikEihsCFDn2pcmJ-EiX5GozE8lFtfQig-fZTGoyausFw,It's really a good app ♥︎ this is my one of my favorites app but there are few problems I've been facing 1. When we click our saved audio and then come back to our audio saved page we again come to the top of the page instead of the clicked audio; you need to fix this :( 2. I can't be able to see my proper following account list in order from [EARLIEST] the list keep me showing same accounts. Hope it's help u to make Instagram better >3,3,1296,312.1.0.34.111,2024-01-04 22:52:58,,,312.1.0.34.111
22b45be2-584d-4856-ba40-a3ec9d143087,jennie //,https://play-lh.googleusercontent.com/a-/ALV-UjWd-_eUGe2P2yJBMFqY07lhzrwHVAvA1XsjtBKKBFAzKb8,"In all honesty, the app and the design of it is great. The main problem are the constant glitches that persist to this very day. I've had posts being taken down for crazily funny reasons that literally have nothing to do with the content in question. It'd be great if the technology behind that was improved ever so slightly so it doesn't flag posts for ridiculous reasons. It's frustrating and upsetting to see.",4,46,313.0.0.26.328,2024-01-10 20:27:31,,,313.0.0.26.328
fe7db8af-e1eb-40b4-8b71-911d9e372e5a,Harneet Kaur,https://play-lh.googleusercontent.com/a-/ALV-UjWmz8WX6lggEJWuledz6e9j8TL2_GWirLccRypLqfw8R7U,"Lots of bugs/irritating issues: Some of my highlights and stories just don't work: The gif stops or the audio/music on it or they don't even load. Whenever I open a song to check out reels on it, they don't work and stay freezed. Search messages feature is full of bugs. Looking through exchanged pics/videos is a hassle - it doesn't go forward or load more. It's in specific profiles.",2,9685,306.0.0.35.109,2023-12-28 08:28:14,,,306.0.0.35.109
9e1d7248-6f6a-427d-a1f0-9e6409a538a9,Lucinda Kaserahki,https://play-lh.googleusercontent.com/a/ACg8ocJhTnCrn2ILu1w__WEoDfvBmP_37lbTV8jg5Ro17uXqdg=mo,For me it is complicated to use. I would like to be able to also ad text only or with pictures in the text or text aside each picture. It is also very annoying that lots of times when I am almost done editing every photo (which always takes some time) the app crashes and I have to start over. Also I am absolutely annoyed by all the suggestions. If want to see something I'll find it. It is a good app tho but with some glitches to fix.,4,469,307.0.0.34.111,2023-11-08 05:48:22,,,307.0.0.34.111
16e31382-b749-489c-a438-4fe180a326ec,Akhilesh Anand,https://play-lh.googleusercontent.com/a-/ALV-UjUhr1xuGheh2o19aTRJYvzV5dPLYN3fyqm91TNDL-rKmd8,"Used to be a good app with most things functioning normally - but they keep trying to 'update' features and breaking every good thing about Instagram. Used to be, when you're scrolling and come across reels displayed in series, you could scroll from one reel to the next. Now you have to get out and manually tap on the next in the series. Idk if this makes sense, but it's a very frustrating update, that just makes me not want to go through reels. I understand this is a nitpick, but it is frus-",1,1957,308.0.0.36.109,2023-11-17 05:14:38,,,308.0.0.36.109
bb8bd622-48e9-4bdd-8f43-58a90b1e3502,Katerina Tassi,https://play-lh.googleusercontent.com/a-/ALV-UjVE-0KWBC1LhVjB_FCi8waZp32XC-ko39urIIzzpSe7ttDa,"The app is great, you can express yourself through your content. But they're adding more and more functions and I think it's too much.. I always get updates only on my 2nd profile and not the principal one. Creating or editing reels directly on the app is almost impossible.. everything glitches and loads for ages. If you do something do it good, or don't at all. This is my opinion, my experience.",3,1320,309.0.0.40.113,2023-11-23 19:07:12,,,309.0.0.40.113
aafc4559-2fb9-4ba1-9866-b2f58f77ea37,Preeti Mahna,https://play-lh.googleusercontent.com/a/ACg8ocJJxWbWfuf8cJgFCpZI2K9NUYE_PIxX4Eky3qvSpcb-=mo,"I've been using Instagram for quite a long time but recently, I've encountered several issues that have significantly impacted my experience. From unexpected crashes to slow loading times, it seems like there are some serious bugs or technical glitches that need to be addressed urgently.I hope to see improvements soon so that I can continue enjoying the platform without interruptions.",1,1959,311.0.0.32.118,2023-12-18 13:52:08,,,311.0.0.32.118
64f8a8c3-93b0-41ed-9394-2146f976c7c6,Nishaan Fogla,https://play-lh.googleusercontent.com/a-/ALV-UjXszFy35nze7gH4T4f0O1BN1KdM1Z7FSXAzZ3TQRHGW5QE,"Hi, since a few months now, I am facing troubles with Instagram which I thought of initially as a technical error. But it's persistent. My Instagram doesn't load fully and properly. It's stuck. Suppose I click a story to view it, it keeps on loading. Same with some accounts and even my feed. Please look into this. Update: Seems to have been fixed. But a few technical glitches seem to be always there.",3,82047,306.0.0.35.109,2023-10-31 22:37:44,,,306.0.0.35.109
8a6478fd-8ee6-4dad-b5e9-84cf120e2e8e,Frankie Stein,https://play-lh.googleusercontent.com/a-/ALV-UjV594xQjuWhvNQ-jH8alsyhlHDSC9JyPmAGKvYybZkUuE0,"This app is an absolute dumpster fire! It takes about 6 tries to upload and edit a series of photos. The AI system flags things, unneccessarily. The app saves your login info, even if you tell it not to. The accessability features, such as captions, only work 40% of the time. Reels like to decide they are photos, and permanently freeze. Stories turn black or delete themselves. Bots and scammers, EVERYWHERE! Currently, it won't even load the login page. I have tried reinstalling and everything.👎",1,2252,306.0.0.35.109,2023-10-27 19:55:00,,,306.0.0.35.109
d6265926-8a08-496b-8939-9185c11ef965,Gabriel Casas,https://play-lh.googleusercontent.com/a-/ALV-UjVjsEyIg0by3mQxA5JLZHsuZw8wQi_QwyDoHI15v5ze88VM,"I have fun on Instagram despite the many bugs on Android that never get fixed. Occasionally, the various blocks the layout is made of disappear or change from black to white, etc., so you can't see what's going on anymore and have to kill the app. Also, the stories I add to my highlights systematically end up not playing anymore for a while, if not forever. They keep loading but won't start. My friends have confirmed they can't play them either anymore from their own phone.",3,609,309.1.0.41.113,2023-12-10 02:25:23,,,309.1.0.41.113
5f439cae-63ad-4dc6-be80-33b3977c29a8,Tasha King,https://play-lh.googleusercontent.com/a/ACg8ocJ7Fl4DLF9vcXpDLoq8dJbU_8Ko8Pv-ZPUKV1f3f8ka=mo,"Instagram is my go to for social media. However, it has been pretty damn annoying the past few months. It has so many glitches. Sometimes when you take a vide the screen goes black or it crashes. It sends your stories to people from your messages when you go to add a story. When making reels it constantly erases the audio so I have to go back and add it and then it will tell me the audio os unavailable when it let me add it before. Can we please fix these issues?",2,972,309.1.0.41.113,2023-12-09 07:51:11,,,309.1.0.41.113
2cf3fea2-a0cc-426b-9d3a-9a7de3dd2f83,Ashna Mg,https://play-lh.googleusercontent.com/a-/ALV-UjXJzZwb0nkMsBAAfyuB_efJg9ZJt-lqNPjhbyXychitN-4,"I have recently noticed a lot of bugs in Instagram. When we're on a post or reel, reading the comments, and then try to go back to the post, the entire app reloads, showing a new post on the screen. Additionally, on the recommendation page, if we click on a post with multiple images, the first slide won't load unless we slide to the second and then come back to the first again.",3,15959,309.0.0.40.113,2023-11-22 16:38:33,,,309.0.0.40.113
c9462bfe-7085-47f3-af5e-7731543f7232,Irvan Alexander S,https://play-lh.googleusercontent.com/a-/ALV-UjXK7glSACXrYnK9lVUXe7xaksHS5pUw8xU7Iu7KyD_LFA,"Music is one of the best thing happened to this world, and people love to share to the others about the music they're currently listened. But placing that feature at message column is just simply, funny. You should place it at the main timeline, and please, without view count, as it only encouraging people to not open/see it, trust me.",4,674,308.0.0.36.109,2023-11-09 17:50:15,,,308.0.0.36.109
5aa69ff0-c6df-4941-a4f1-80dd7b3cbd50,Rab nawaz,https://play-lh.googleusercontent.com/a/ACg8ocIBlItVinHbKhaDMQrtYYk8s91JxeRC9i_pxOYjfG_E=mo,"Instagram has been my go-to app for years, allowing me to connect with friends, share life's moments, and discover amazing content. From stunning photos to entertaining stories, it's a platform that keeps me engaged and connected. The user interface is intuitive, making it easy to navigate, and the constant updates keep things fresh. While I love Instagram, Il'd appreciate even more transparency about how my data is used. Overall, a must-have app for staying social and entertained!",5,4674,309.0.0.40.113,2023-11-19 23:25:23,,,309.0.0.40.113
11f737fb-2674-4f77-8525-1dc5008c05be,Neeraj Sharma,https://play-lh.googleusercontent.com/a-/ALV-UjWwaAArm_3ufud725qQ8Q_O3fsafwFaPoQyofnufe7kRUg,"Lately i have been getting a lot of bugs in the app experience. The stories and posts are not uploading with music. The app tells me to connect to high speed internet connection. The internet connection is already at 30-40MBPS. How much more speed do you need. While scrolling through reels the like, comment and sharing button appear anywhere on the side of the screen and not in their designated location. When are these issues going to get fixed?",2,8916,309.0.0.40.113,2023-11-21 22:05:50,,,309.0.0.40.113
2f12ed99-a23a-43f2-a06f-940976ec2e1c,Mazhar Hussain,https://play-lh.googleusercontent.com/a-/ALV-UjVUhvnOP8_3wIEb7bSE9wBo_lpQi1K0QgSLYG4qHXQbcA,"Glitchy ever since recent update. Some posts comments wouldn't load, while swiping through reels, tap screen like option doesn't work sometimes, hold the reel option doesn't work, need to go back and forth to get it fixed. And, the highlights, once opened, if I click on share option or more options once, it doesn't open again but remains blank and irresponsive. It was all going good before the recent update.",1,1109,309.0.0.40.113,2023-11-16 12:01:42,,,309.0.0.40.113
2309250e-7416-42c8-8dcf-5ee70a7c0c1d,Dylan M,https://play-lh.googleusercontent.com/a/ACg8ocLoZQNuEy5zwV3v68BSbfdLfXcaCTQrF1X5H7NutzBP=mo,"When the dark theme is enabled and you click on a link in a bio, upon returning to the app, it displays a light theme with white text, or it remains in a state of ""in-between"" light and dark themes, impacting readability. Additionally, every time you scroll, switch to another app, and return to Instagram, the timeline refreshes, hindering a seamless experience while browsing through feeds. These issues affect usability.",1,854,309.0.0.40.113,2023-11-21 18:29:20,,,309.0.0.40.113
31bd70ec-5549-4f02-8b8a-00506c5e8b4c,Emily Gaffney,https://play-lh.googleusercontent.com/a/ACg8ocJQPW5YBTBHjhIQHOEi7AFAhFoamJD6pLUZF5OrwY8c=mo,"I enjoy creating reels and using the music and templates but instgram uses up all my phone storage every time I edit a reel. I have cleared the cache and data, uninstalled and reinstalled more than 5 times and the problem persists. Also, when I use the templates to create a video, it used to show me how long each clip is, now it won't show me. This app needs some serious debugging. It is very frustrating.",2,1229,309.0.0.40.113,2023-11-26 07:03:47,,,309.0.0.40.113
f7244a58-8fd9-4caa-a0a5-1f8f203654f1,Maxeen David,https://play-lh.googleusercontent.com/a-/ALV-UjUlXRUm2_0YVCmvBK0mxdZAIiwNv2Slj8JmZPrX2F3-s_g,"Hi, i would say that, Instagram is a great app, i could see the posts and reels of the people i follow and it takes good quality pictures, but the thing is, when i want to save a photo with a song on it, and doesn't let me save, it says, ""Save video without the music and effect?"", I mean, i would normally save photos with a sound and effect on it, but it doesn't let me save anymore. Please fix this issue, thank you.",2,232,310.0.0.37.328,2023-12-12 19:45:18,,,310.0.0.37.328
5b6fe750-acbd-4c9c-b137-36a39819da03,vurrina rose,https://play-lh.googleusercontent.com/a-/ALV-UjX2fDwf7CPbizBdW5N68xw7-x-5psWa-9qU5kHTXT7wNw,"This app is really TERRIBLE, especially after the last update, you can't comment, you can't share videos, you can't post anything without an error message! And it suddenly close on its own, or sign out! Like what the hell?! It's like it's haunted!! I really wish someone with beautiful balanced mind and soul, would come out with another similar app, so that everyone could switch from this completely useless app, and actually have an enjoyable user experience.",1,2117,306.0.0.35.109,2023-11-22 08:51:52,,,306.0.0.35.109
31f56989-34b8-473a-bfd1-a3af5698cc47,Jessica Lynn,https://play-lh.googleusercontent.com/a-/ALV-UjVaOr5hpG-3U39mDBIfc4INJAFL_tmI2derAp2tnrCWVuo,"I've had this app for several years and never had so many issues. The worst part is I'm missing sound from old videos that were really special. Also, recently, some of my saved story highlights are disappearing from my feed... tried reaching out to them to never hear back multiple times now. I guess I'll just have to keep backups of everything and no rely on insta, but that doesn't help me with my decade old videos.",2,1053,307.0.0.34.111,2023-11-06 12:15:32,,,307.0.0.34.111
66ce8f84-14f1-4344-a8e0-06081f8a17ae,Abdullah Khan,https://play-lh.googleusercontent.com/a-/ALV-UjUFe6a2Jrtm1paeR-mYHWLD75g-TDZhcefakgPKXsM-Aw,"Hello, Instagram support, I would like to suggest a good suggestion to you, with the development of the videos, which was an excellent addition to the Instagram application in the recent period. Users started making writing stories or videos from movies, and it was divided into several videos. When a late person comes trying to find the second part of the clip, he does not find it among the huge number From the videos, you should add the option to follow, thank you.",5,14561,307.0.0.34.111,2023-11-04 22:29:56,,,307.0.0.34.111
f75e3803-c97a-4bea-a087-60da0c71deb0,Muhab,https://play-lh.googleusercontent.com/a-/ALV-UjVuHzeVUXCcl-2hFv9-TizalE5IRElxzy7w-qhQzv9pXw,"This app is an absolute dumpster fire! It takes about 6 tries to upload and edit a series of photos. The Al system flags things, unneccessarily. The app saves your login info, even if you tell it not to. The accessability features, such as captions, only work 40% of the time. Reels like to decide they are photos, and permanently freeze. Stories turn black or delete themselves. Bots and scammers, EVERYWHERE! Currently, it won't even load the login page.I have tried reinstalling and everything.",1,1276,309.0.0.40.113,2023-11-27 01:34:43,,,309.0.0.40.113
e678aa0b-c69c-4392-bb1c-d64ee6bc59b5,Don Nguyen,https://play-lh.googleusercontent.com/a-/ALV-UjWIoBA96DjEif7e95iLkSM1LfqIxkhsjtpvb8xsU0CcIHKF,"Purpose of the app is fun and easy to use but there is no consistency in the UI. I don't know why the developers keep changing it. Contacts changing back and forth between lists and bubbles, rearranging contacts, adding favourites that aren't at the top of your search, tap to pause, then tap to mute, then back to pause. Just stick with one UI please",3,785,309.0.0.40.113,2023-11-18 05:25:30,,,309.0.0.40.113
360e32a8-2ba9-49ed-be1b-5be3e0afbdef,Mari,https://play-lh.googleusercontent.com/a/ACg8ocJX9A3KGrEW3uUglvhAsnAVAsimzeZcaSuDwitf7Zy0=mo,"So as of right now, whenever I took pictures and added music, my story would not post. But when I picked a picture from my gallery and added no music, it posted🫤. I never had a problem until now. I don't know if it's my wifi, but I truly doubt it is so please take a look! Edit: A friend has also agreed that there have been issues so please fix it. Find the problems and find a solution",1,62,311.0.0.32.118,2023-12-17 20:51:36,,,311.0.0.32.118
59949a7c-d8f3-4740-8acc-37b7251d9417,Danica Medel,https://play-lh.googleusercontent.com/a-/ALV-UjWVFGlJudW2EkdBeHH0Fa_fgw_mUl_H2vOazh1GHFXs2bG6,"My other account doesn't have the new update features even if it's on the same device. It still doesn't apply to this one specific account even if I tried to install and uninstall the app multiple times. I hope it gets fixed. For example, the resizing of story to full screen when tagged feature, the short clip in note feature, I don't have it.",1,75,311.0.0.32.118,2023-12-17 21:33:03,,,311.0.0.32.118
5196d490-30f4-4ed9-82a2-88519c0ad5ee,shinta humaira,https://play-lh.googleusercontent.com/a-/ALV-UjWWNe5DMO351pR9phVMFTR2K_dFhNUgKG0MhHbu_4jTj2w,"I've been using Instagram since 2014 and I actually love it. But, few days ago I lost my access to Instagram music. Everytime I open others' stories, then a notice ""This song is currently unavailable"" keep popping. I thought it was only going to happen when I see others' stories, but when today I try to add music to my story, all the music is gone. There are only few instruments left and I cannot find the music that I want or anything else beside those instruments. Please fix this ASAP.",1,587,309.0.0.40.113,2023-11-27 19:31:55,,,309.0.0.40.113
7777b0fd-6e58-4346-89c8-ad925a50d8bd,The self-love Project,https://play-lh.googleusercontent.com/a-/ALV-UjX6pMWf1qYhCEXuv3wzZSQCEiuQx2TIaBZQjFhRg1QzPpqW,I gave it one point for the nice UI and experience of sharing pictures and videos. The app is evolving well but the algorithm behind it is oppressive and political limiting the freedom of speech and is obviously promoting one type of content in some sort of propaganda... So overall unless this is changed it's an unsatisfactory app in an unsatisfactory world. Thank you 😊,1,319,309.1.0.41.113,2023-12-09 21:25:08,,,309.1.0.41.113
2c42b95e-5df1-4af5-a704-37fac7a859a9,Lucas Pascale-pallotta,https://play-lh.googleusercontent.com/a/ACg8ocIjW3r_heEQmRMx4b2G9MUpjiGiM7vqeVy3DtUMN4DB=mo,"The app keeps changing without notice. Would be nice that when you change parts of how your users interact with your app that they are notified of the changes made and how to use them. I also see an increase in bugs. I have about 10 posts which I get an error for and won't upload. I actually sent an email to your support but not a single reply after 4 days of waiting. Which is why I am writing this review. If you are not using Instagram don't start, they don't support you and they break the app.",1,19,312.1.0.34.111,2023-12-23 17:22:45,,,312.1.0.34.111
dbcbc53c-b8c4-4ef8-a45a-5b78d7b37ecd,Marat Aysin,https://play-lh.googleusercontent.com/a/ACg8ocLObhyG7hocjny1KOLBsNRgdpsLwaKq6q85gn0LZtpNXg=mo,"2024 and we still support only square fotos. Only stories allow full pictures. App glitch if you fotos have different scale and no inapp possibility to do it. If you made horizontal 6:19 video, prepare noone will be able to see it. I'd like to place 1 star actually for the amount of advertising. It is just too much. Also, algorithms deciding wrong what I am interested in.",2,3,312.1.0.34.111,2023-12-21 04:14:42,,,312.1.0.34.111
da6c403e-8756-42c1-bdc0-f5d54ff245c8,Dharshan,https://play-lh.googleusercontent.com/a-/ALV-UjXArE3pnvHC4A7qhSnD5t1HYDftF1YXgIFRWLws3fQNI-8,"It provides a convenient way to share photos and videos, connect with friends, and discover new trends. The user interface is intuitive, making it easy to navigate. However, concerns about privacy and the impact on mental health have been raised. While the platform offers various features, such as stories and IGTV, the algorithmic feed can sometimes be frustrating.",5,9778,309.1.0.41.113,2023-12-01 23:57:20,,,309.1.0.41.113
a974ffab-dd7c-43a5-9a9d-7660b805938f,Kieran Birrane,https://play-lh.googleusercontent.com/a-/ALV-UjUT61H1eetftZhFU8rRSXpY-HnbZxZ6qju_lQp22GSlrPg,"The share list for sending content to friends is super ridiculous. My most interacted with friends are never shown at the top of the list, instead I have to search for their name each time. It's also a terribly awful app for making posts which is it's primary function! It should not take me 30 minutes to make a post - the inability to edit drafts by changing the photos included in them or the awful default cropping options requiring external apps.",1,520,306.0.0.35.109,2023-10-31 00:26:57,,,306.0.0.35.109
a41803a6-b547-4349-8078-57e262cefce9,Bella Dixon,https://play-lh.googleusercontent.com/a-/ALV-UjXvNI4yk2b91dZKu44lUDkK-uQUYE2RCutzlAKrOMVPCw,"To be honest I like all the features of Instagram, but the frustration of when I open the app and see something I want to see then it disappears and reloads to something new and I can't find the original thing I wanted to see, honestly outweighs all the positives. It's a really sucky feature, which you would think would have been fixed by now.",1,584,309.0.0.40.113,2023-11-27 05:35:14,,,309.0.0.40.113
2413a758-7ee1-4c96-aa74-81e641443af4,Kirill,https://play-lh.googleusercontent.com/a-/ALV-UjVbx8znfDPkLEqA8gqmTBxw8-ibLrqe46CfLE7ATWtIzZQ,"Thank you for the survey. It's nice that you are interested in the opinion of your users. Please reduce the amount of advertising and make it easier to use the main feed (the block under stories). This is the most important thing. At the moment your main feed is just dead - a huge amount of ads (often completely useless and annoying) and with very poor relevance, without the ability to at least filter the feed. Thank you, I hope you will read and listen.",1,12,313.0.0.26.328,2024-01-12 02:54:42,,,313.0.0.26.328
bc50c90b-c8d5-472a-a882-61183f3a41c8,G- TRIX,https://play-lh.googleusercontent.com/a-/ALV-UjU1GtNi_I-C-TaaeE3i9q6y5rgsxoznIEIBgMOmKedqgg,"I've been a long-time user of Instagram, and I must express my disappointment with the recent update. The changes have taken away the simplicity and ease of use that initially drew me to the platform. I strongly urge Instagram to reconsider and bring back the old update. The new features are not as user-friendly, and the overall experience has been negatively impacted. Please listen to your users' feedback and consider reverting to the previous version.",1,8,313.0.0.26.328,2024-01-13 11:44:17,,,313.0.0.26.328
bf006d2b-c8ba-4321-9ec3-2296e5d23650,Vicas charles,https://play-lh.googleusercontent.com/a-/ALV-UjUpj9CZfW9oMRlfXsyxsaICjH1PH__kM1zKapQGCkZBgeg,"Not well optimised for pixels. Although my pixel 6a device allows 3rd party apps to use all the camera sensors and night mode, Instagram doesn't make use of it, still takes the screenshots instead of actually clicking the pictures. There is also a bug that needs to be fixed. If there is a post with multiple pics or videos in it, when we open it the first photo or video goes black. Unless we swipe to the second and come back to the first, the first one will not be visible.",1,2703,311.0.0.32.118,2023-12-13 12:31:32,,,311.0.0.32.118
44120778-286c-4752-8349-48a7f2abc794,Damian Diaz Gonzalez (Derian),https://play-lh.googleusercontent.com/a-/ALV-UjUx3HeR_W4N31SDuw_bPtgpON2fPrZhQ4UMCLVvnKEYdg,"I think the app is out of control, or falling apart... I've been trying to like posts or follow some random accounts for two weeks now, but nothing happens... "" Account Status "" in the Settings section says """" everything is fine, you can use all features """" but it doesn't work ( I can't unfollow , like , follow or anything else ) .So I wrote an Issues Report about it, no answers have been received. 😓",2,11,312.1.0.34.111,2023-12-21 04:10:13,,,312.1.0.34.111
8614d36e-35f4-4dd2-8122-786a31e52086,Kunal Bajaj,https://play-lh.googleusercontent.com/a-/ALV-UjXtbgxz4BLxyq2GxbPVsmOZBE3Mna2tPwasqtf41uxn2O0w,"I have had multiple instances where I just want to throw the phone because of crashes and strange phenomenon! It balloons up using more than 113GB of storage on my S22 Ultra! I have two business accounts and every time I draft reels, and then save it, pressing BACK deletes all of the hard work. When I start fresh, new reel, then add a video from the gallery NO controls appear! No icons/tools, not even the play/pause icon! Have to use the android app switcher and force stop the app. BUGGY",1,75,311.0.0.32.118,2023-12-19 00:34:39,,,311.0.0.32.118
f34081b9-69d0-4e4f-b08c-108f1df031a4,David Rodriguez,https://play-lh.googleusercontent.com/a/ACg8ocJCAI5ul__ybkT1NDhZmmh-7vxaeoUnKKPZVpo1J8gK=mo,"As an Instagram person I don't feel happy complaining about my favorite app but lately with the latest update the app started having some trouble such as getting buggy watching reels and the comments of the previous video opened appear when you click the comments of the next reel. I hope you can solve this, it's really tiring to have to deal with this, thank you",2,9,313.0.0.26.328,2024-01-11 11:28:30,,,313.0.0.26.328
0ff247e5-7134-47bd-8a02-5e682fd31a5d,Thomas Ledgley,https://play-lh.googleusercontent.com/a/ACg8ocIZQ3omN_x1vuuMwfDJcqKUxK1yrEcIYrt_R5gNDL1pMg=mo,"The last year has been nothing but trash from Instagram. Terrible feed design that forces you into reels at every opportunity makes me close the app out of frustration constantly. Algorithm on the main feed is equally awful and you can't change settings to make the default page ""following"". I get that in-app time is where the money is at but what a joke of a user experience. Do better.",1,39,312.1.0.34.111,2023-12-27 12:02:17,,,312.1.0.34.111
51f971db-954f-47b7-ba17-2295716db98d,Vlad,https://play-lh.googleusercontent.com/a-/ALV-UjXibaH0KRdDRWsUvpWs8ZQLmrnYIdkQHZD12CwPUsB890c,"It's a good app but its been bothering a lot for some time. When I try to log in into an account it doesn't let me log in. It says ""username doesn't exist"". When it clearly does exist. Because of some bugs I've lost a very precious account of mine. The funny thing is that its only wrong with thr app. If u try with website it works. I don't know what's happening but its not just my phone. Please fix it. Its not the only issue. I expect a reply.",1,285,312.1.0.34.111,2023-12-30 11:06:10,,,312.1.0.34.111
