reviewId,userName,userImage,content,score,thumbsUpCount,reviewCreatedVersion,at,replyContent,repliedAt,appVersion
d4fc7685-5c67-4048-b013-13d8cb6a51d5,Alejandro Padilla,https://play-lh.googleusercontent.com/a/ACg8ocImJT2gX7kd-19mlgOLXa1U3GZMCiuEkpN_vFkNL087CA=mo,"Most of the features that i actually enjoy on this app are constantly getting broken by updates. The save feature on chats hasn't even worked for months. Not only that, it's so sad that for an app that is entirely picture based how badly any image gets compressed and ruined and that's not even considering the video compression. Year later same thing. App constantly broken videos inside DMs haven't been loading for months",2,21,312.1.0.34.111,2024-01-05 23:01:38,,,312.1.0.34.111
0738e15b-0354-4143-9571-0a738e5fbb6f,eowyn,https://play-lh.googleusercontent.com/a-/ALV-UjU171aUwywDYjFmpqU1RUctEQ7eI2GQB5Vt8_gRvhmgtq4,"i enjoy posting on Instagram a lot! especially when I can use the music feature. however, i wish that there is an option to add music to something I've already posted, whether it's a post with multiple photos or a single photo post. i think that this feature would be something a lot of other people would enjoy using as well.",4,9,312.1.0.34.111,2023-12-31 04:03:47,,,312.1.0.34.111
9f6aaed1-07cc-4236-a155-ae7ef9f252e3,michael vargas`,https://play-lh.googleusercontent.com/a-/ALV-UjXrFDQWolYT80YFM1TKE9sUTq4oez6m6gi26PbJyC5J,Second time ! have to report the same problem. It's unfortunate that a great company like meta can't fix minor bugs in a reasonable amount of time. I haven't been able to post to my story for about a week now all videos turn black and the app crashes. 'm currently on vacation and it's a disappointment. My previous message didn't receive a response and that's another disappointment. Good job meta,1,645,308.0.0.36.109,2023-11-13 19:46:39,,,308.0.0.36.109
a075e651-ed73-40c2-b980-84d0f843ce99,Aure,https://play-lh.googleusercontent.com/a-/ALV-UjXRoUgrONmoo8qD2IPMCT9Fr7wur4-rnXWaWhHaQAq6iks,Irritating and trash. IG used to be a good app. Today it's full of trash and stolen videos and images. The thing that irritating me the most is everything time I launch this trash app and I see something interesting (yeah it happens sometimes but rarely) IG will swipe it away to never being find and instead will show me the same annoying contents that I DO NOT want to see. And those stupid videos with the same songs playing them again and again and again. This is insanity!,1,12,312.1.0.34.111,2024-01-04 10:47:05,,,312.1.0.34.111
25fa41dd-701c-4051-96de-f62623b028a8,Shadow Sojourn,https://play-lh.googleusercontent.com/a-/ALV-UjXNaIaLSEnRsg2w2DU7u4Qq0A6pNjumZUtxiAM0q7qdYA,"No longer allows login. ""Unable to login. An unexpected error occured. Please try logging in again."" MONTHS OF THIS. MONTHS. No fixes, no patches, just a broken app that physically can't be logged into. Best course of action is getting on a PC somewhere and deactivating the account like the trash it's become. Congrats to Meta for killing IG! Not as bad as Twitter got it, but it's still DEAD.",1,8,312.1.0.34.111,2024-01-09 22:07:40,,,312.1.0.34.111
330ef594-08ec-407f-91c0-c9bf8943e8ec,A A,https://play-lh.googleusercontent.com/a/ACg8ocJFL-h2psfScwiwM0wV_VQeBjYmJgWnBj0qbUWyqwDR=mo,"Instagram has been around for years and it's still one of the worst functioning apps. Open the app and it immediately reloads for no reason? I think they do it on purpose so you spend even longer on their app trying to find whatever it is you just saw. The whole thing is just to mind-f*k you to look at more ads, get more riled up, and waste your life.",1,12,313.0.0.26.328,2024-01-13 03:55:29,,,313.0.0.26.328
7274018f-f1e3-4e44-840d-855708aa9870,Ashley Branner,https://play-lh.googleusercontent.com/a/ACg8ocLCFaq77jehHWai_3UmLQn2igK0FyvFjHfEpawpMPh_=mo,Auto scroll is ruining my experience. I love how someone Instagram thought it was a great idea to implement an auto scroll feature before you can turn it off in settings. Sometimes it tries to scroll BEFORE A REEL IS OVER. Good to know Instagram is greedy and is probably just trying to make people consume more ads.,1,13,312.1.0.34.111,2024-01-07 23:48:09,,,312.1.0.34.111
be4f31fe-5f1a-4a5a-9563-d227ea28f41c,Jennifer M,https://play-lh.googleusercontent.com/a/ACg8ocLM8xes9PnutnPcQDZ7Jr8TTP4fpB8yoFLcKe38mycXkw=mo,Latest update essentially broke my instagram. My reels crash when loading and I lose my work. I cannot access my photos on my SD card anymore. Online forums say to downgrade to the older version as the newest update broke this function. I've never experienced so many glitches in the app. It's really frustrating.,1,4,313.0.0.26.328,2024-01-15 04:36:29,,,313.0.0.26.328
67263566-bf84-41f5-9169-7b3a88cbed05,Mindi Koss,https://play-lh.googleusercontent.com/a-/ALV-UjWZ1K2hdcXypDJ7Bd8H6PlXQGqSburvct6Mau-mAntgEAk,"IG (along with all platforms) can be good or bad, what you seek is what you find. If you use it for good in your life, whatever that is; business, entertainment, learning, mindless scrolling, then you can benefit. If it's used incorrectly, for comparison, or searching worldly 'idols', or 'I wishes' then it can be a negative thing to use.",5,19,312.1.0.34.111,2024-01-05 02:33:39,,,312.1.0.34.111
386baf3a-09d6-4d24-a00a-a825add64405,Patrick Cancilla,https://play-lh.googleusercontent.com/a/ACg8ocLvmhtgPoaazW4mY1dE8gC9V0XeoMSnXfxpJ9hax0VL=mo,"Glitches Galore! I loved browsing the feed, seeing all sorts of fun and crazy posts. Now? I can see maybe 5 or 8 then nothing, freezes or just blanks. I've tried every fix the internet has to offer and nothing works. Of course, asking IG for help is completely useless.. App is complete trash now..",2,6,312.1.0.34.111,2023-12-27 12:55:02,,,312.1.0.34.111
b04e2e72-70bf-4981-bc91-0630f60e97b9,Izzy Bee,https://play-lh.googleusercontent.com/a-/ALV-UjXQkc0qcSVMX8jSJoreL1p8FrJ_LjXbKDYboR9MnFJb2gY,"Glitchy. Every time they push an update I lose functionality. The home feed refresh is out of control. If I set my phone down and the screen turns off or I look t any other app, it refreshed. It's an absolutely terrible user experience that you can't turn off the excessive automatic refreshing.",2,8,312.1.0.34.111,2023-12-28 01:07:08,,,312.1.0.34.111
47983105-dbcf-46f4-aca0-ebb4d8b143da,Margaret Scanlan,https://play-lh.googleusercontent.com/a-/ALV-UjWLv-d6deu-nJX8pfpWg9VdQP6B7_b1FuGnPjAgly_sDMAl,"I can't even begin to describe all of the issues I experience on a regular basis. This app is the worst. I have lost more drafts than I can count. Hashtags will auto populate while I'm working on a post, and the undo button doesn't work. The albums don't appear correctly from my phone when I post. The app auto refreshes when I'm in the middle of watching a reel or creating a post. I can't see what I'm replying to comments because it appears in a continuous line that I can't scroll through.",2,852,309.1.0.41.113,2023-12-02 11:46:24,,,309.1.0.41.113
b0f52eec-f412-4bbf-a109-7c2bb4d3c33e,Jamie M,https://play-lh.googleusercontent.com/a/ACg8ocLFGjVaMAY7svhM2IULPGU9JOhuTs1nudBDjxqs7VwY=mo,"It has a bug and said to clear the cache. I did and it's still not working right. I can't post a story directly from the little button at the bottom of the page. It'll crash. I have to go to my video or photo, and share it from my gallery to ig for it to alow me to post a story. But i can't make a genuine boomerang, or a fresh story post. Fix your bugs. All this meta glory and they can't even keep ig clear. Smh",1,328,310.0.0.37.328,2023-12-12 01:27:38,,,310.0.0.37.328
eb57ddc4-fbf0-42b3-9770-aaa217b6f325,Noah Blankinship,https://play-lh.googleusercontent.com/a-/ALV-UjX_HRUfr_0qnPdDB7GxZv097ey0B-l84MjJ1JZOYHqnRZs,"I don't want suggested posts in my main feed, a 'feature' that until recently I was able to easily disable. Instagram has a habit of taking away useful functionality, this is only the last in a litany of issues. Hopefully this will be amended, but if you're reading this, know that it hasn't.",1,12,312.1.0.34.111,2023-12-23 04:11:16,,,312.1.0.34.111
e1e62bab-bc7f-459f-b965-d1c0597e6a8d,Eowyn,https://play-lh.googleusercontent.com/a-/ALV-UjWn3Gyn3FRAHdGN7oh0o0EZdmJPwXaVnbtCH7XJ8jSAIUD4,"Instagram has been tweeking a lot lately, like the chat bubbles are the wrong colors and it's just been overall laggy. Also the lack of songs is starting to really bother me, like I keep going to select a song for my status and then seeing its not there. it's annoying. also I like to read back old conversations, and it's really annoying how when I search up an old message I can only read a small portion of the conversation",2,721,310.0.0.37.328,2023-12-11 10:26:53,,,310.0.0.37.328
11408b94-8e88-4421-9ff4-ffe8b3d58d71,Alyssa Padilla,https://play-lh.googleusercontent.com/a-/ALV-UjVlZrqhyIPDneLRTbQuQi8191cEnnWWqbQtiI9KiQsEEg,"Instagram is usually pretty good but lately calls have been kind of off. Other than that it's really good to make new connections and find content that you enjoy! The last month or too though reels, audio, and like I said call audio has been super bad. Either you can't hear the other or they cant hear you! Sometimes it'll work for s while but then randomly cut out.",3,394,307.0.0.34.111,2023-11-17 00:29:45,,,307.0.0.34.111
7bccc480-154c-4f0d-9266-a783568e83b0,Morgan Draegar,https://play-lh.googleusercontent.com/a-/ALV-UjXElcOOxRQBcWcjVWmL-qAKSI96So2fnlZ-uz10vPKhnYVm,"Most suffocating social media app. Can't even download people's pictures, the censorship is ridiculous, and don't get me started on how oversimplified it is. Easy to find art though. ALSO apparently they made the size of buttons even smaller so when trying to heart a post, it does something else entirely unless I press the exact center of the heart. Also freezes constantly, and there's next to no moderation, just a half-baked bot. Trashy app.",1,129,309.1.0.41.113,2023-12-01 23:57:23,,,309.1.0.41.113
f6027d84-e649-470a-a0b8-f5e0c08be9ad,Rachelle F,https://play-lh.googleusercontent.com/a/ACg8ocLojSQY_z-gYxF24KdLm_rN-vJHl_2dq9E97nFDStbf=mo,"10.8.23 The app is buggy... no matter what, I can't make a story or take a picture. It either stays black screen or just freezes.. I've never seen so many issues in an app that still haven't been fixed when reported. They never fixed this issue when I reported.. Update still not fixed. Its kind of pointless to have the app if it doesn't work. 11.27.23 this app is a joke. Can't make a Story anymore because it's frozen n more issues than that!",1,1202,309.0.0.40.113,2023-11-28 06:09:06,,,309.0.0.40.113
542b7efb-8e7b-4e34-a537-00f6d23e84d5,Khelisie Salvatore,https://play-lh.googleusercontent.com/a-/ALV-UjWcGyhBxgZG3jv-0ZnKEsYOSDnOrGxtZ21myAMHiN-iou4,I love this app. Being disabled it connects me to the outside world and I've made real friends on here. I don't what I'd do without it. I'm only giving it a 4☆ because out of nowhere the ability to comment on stories goes away. I u install and reinstall. Doesn't fix it. Look for updates there's none. turn the device on and off doesn't do anything. But then for no reason the ability comes back and acts normal again. It's so weird.,4,645,307.0.0.34.111,2023-11-08 01:42:06,,,307.0.0.34.111
e44c1fb6-9869-4467-89a4-b09b599028ae,Chosen Eyes,https://play-lh.googleusercontent.com/a-/ALV-UjW08lT9UmlAaXPQXynIDXviJ26TVbKZFmvkJy9UYagwLSM,"I actually hate this app, it refreshes all the time automatically no matter what. (With no settings to turn it off whatsoever or switch to manual) Completely ruins any reel I'm on. Just when I back out of the app to set an alarm on my clock, I come back and it immediately refreshes and deletes any/everything I was currently doing. I can't even look at my history of what I was viewing cuz the only way to do that is to like the reel or photo. But insta auto refreshes so damn quick. It gets lost...",2,313,307.0.0.34.111,2023-11-02 19:11:45,,,307.0.0.34.111
3c5ea619-d482-4deb-98b7-fd28cae967a1,Amanda Lorz,https://play-lh.googleusercontent.com/a-/ALV-UjWwQ5pLoqllM5a7GcBZJ6lNpio5JYnhPF4J9F1rIYMOp1o,"I'm really frustrated with the creating a reel feature as the music will not change even when I click something different. I don't think I've ever been able to create a reel and post it without a at least 1 thing not working. My footage will get corrupted, music won't even be there, or just some glitch happens while I upload. Please fix reels and make it actually usable... Small businesses depend on these features.",2,377,309.0.0.40.113,2023-11-19 03:59:44,,,309.0.0.40.113
e6c3e5e4-31af-4717-8b55-5d3618025896,Adelia Hart,https://play-lh.googleusercontent.com/a-/ALV-UjWEHXvn1D1HyImiLvALZzAJxvhRLC5j9KRCT1_U8-7E7w,"PLS FIX STORY FEATURE. i wanna make instagram stories, but every time i try to put a sticker or text at the bottom of the screen, it automatically deletes bc of the button. It's like a black hole that can't have anything near it or it will delete. please fix this. it's incredibly inconvenient. the story feature aside, this app is very entertaining , 4 stars",4,196,311.0.0.32.118,2023-12-17 02:07:12,,,311.0.0.32.118
e8ae2632-3931-448f-ac53-27c5ce0bffbe,Meks Nwa,https://play-lh.googleusercontent.com/a/ACg8ocL97EAzRDM_5FgNEIGSgXP2nDbtzcIXzymGplbWhWlJ=mo,THE WORST APP I'VE EVER HAD. NOW It seems every other week there is some kind of glitch or error that stops me from being able to log into the app. I advice you to AVOID THE APP AT ALL COSTS. WORST APP. I go to some different people's pages and click on the notification bell to get alerts when they post and yet nothing happens. Half of the time when I log in I see the plus icon on my profile picture even though I have added stories to it. Now it randomly stops working in the middle of nowhere,1,577,309.0.0.40.113,2023-11-24 00:20:11,,,309.0.0.40.113
7ee94a34-cc94-4e7b-b2e5-96203e0180d1,Joker's Wild,https://play-lh.googleusercontent.com/a-/ALV-UjWQ6wA6QnoV0PQcEOfqroF3IjkdBivSEI1Ewc1iv2ypGw,"Ever since the latest update, I now have uninstall this app and reinstall it every single day when I want to post. The picture keeps getting cropped down to half the picture. Reinstalling temporarily fixes this glitch. This has caused my experience for the Instagram app to be affected negatively and why I rated it as I did. I enjoy the site itself but this issue is an absolute annoyance. I hope it will be resolved. Update: The issue seems to be resolved now. I have adjusted my feedback rating.",4,8,311.0.0.32.118,2024-01-08 05:16:36,,,311.0.0.32.118
563e37fb-e87b-417c-9e85-98802fe31301,Anthony Copter,https://play-lh.googleusercontent.com/a-/ALV-UjXvXaRpYnCjs5y-gF1Wuu9iH_SeMI11Ey1ZL3rwlXI6GJw,"User Un-Friendly and Frustrating Only allows pictures, no words. Posts are limited to ten pictures apiece. Just one tap can cause a user to erase a whole story. Stories make it a real hassle to use color in text, one tap and all of the colors turn to one color, making the user have to color the text again. Website links cannot be accessed. Text cannot be copied and pasted. Reply buttons are very small which can result in a user selecting a comment instead. Needs MAJOR improvements!",1,669,308.0.0.36.109,2023-11-14 19:51:28,,,308.0.0.36.109
b9245a39-a560-4774-b059-ba38e5861cf8,Erin Guentzel,https://play-lh.googleusercontent.com/a-/ALV-UjWbiOS37AjqjGFUz6Xqc0d3pv8mNRmA7lXzrCnKFesQQA,"If I could give this app zero stars I would. It's great when you're seeing content from other users you follow. The ads and suggested content every other post (or back-to-back) are overkill. Additionally one of my accounts is nothing BUT suggested content, despite having followed multiple accounts. I have uninstalled, reinstalled, and still, nothing to see. Also STOP CROPPING MY PHOTOS!!",1,76,309.1.0.41.113,2023-12-03 11:48:23,,,309.1.0.41.113
bbe90c89-79d1-4bab-89bc-415397c3a1cb,T F,https://play-lh.googleusercontent.com/a/ACg8ocKmvz6hLQ36Lby4yxEfbCwqrDGrWKuwLNa9khqyH7Fn=mo,For whatever reason my settings say I have all app features but this isn't the case. I cannot comment and it gives an error message. When you try to click on the report option you cannot. It's pointless and frustrating because IG doesn't think enough of their users to even respond to the messages but they are quick to restrict some but not others. I have no way of figuring out how to fix my app! So annoyed,1,229,309.1.0.41.113,2023-12-01 18:19:20,,,309.1.0.41.113
ae5fc099-4efa-4b54-a36a-d27de2bf010d,Lou,https://play-lh.googleusercontent.com/a-/ALV-UjWiaK6rag3kNEUSEuku7cAALFOI8UfFEKDVlU4MwHUAwWfp,"Dark mode is broken, if i click a link, click on a profile or anything it is white background with white text. Burns my eyes to look at it. Edit: they finally fixed it (or at least made it available for newer phones, if you haven't given in to getting the newest phone every year get rekt *sarcasm*) New issue: I can't use Gboard gif function even though it's better. Searching the same thing on the 'sticker' function gives 'no results' downloading a gif and trying to post it doesn't work.",3,259,308.0.0.36.109,2023-11-16 12:12:23,,,308.0.0.36.109
5398f320-bff1-401b-a68d-eec8b006d219,Vickey Tillson,https://play-lh.googleusercontent.com/a-/ALV-UjX7CTGclrdT6DiYsTilpDY8tTpPjEuzLvZw6XV7f_1FuqK3,"I'm beside myself at this point. Yes, I'm tech challenged. Yes, I'm a bit middle-aged. Yes, I use an android-galaxy s22 ultra (hooray for the ""s pen). I enjoy making stories. However, my pen and Instagram aren't communicating well.. at all. There's this effects deal that is on the screen, and I've no idea how to turn it off. It's all goofy now, and I'm not a fan. I may need to create my stories on a different platform. I miss the creative options abs ""writing"" on the screen. Send help.",1,463,309.0.0.40.113,2023-11-25 04:43:18,,,309.0.0.40.113
9e54b475-6ec7-4dff-96a3-f7a15626e07f,Selena Aguilar,https://play-lh.googleusercontent.com/a-/ALV-UjUBwiiLugpEozI4fxFd-X2pmKl_P9rkilNDzsFMdMJUbOw,I love this app. It's just been so buggy for me. And really difficult because I'm in real estate and have two accounts that I post content from daily. REELZ features is buggy the apps just freeze on me in the middle of editing and then closes. I wish I had the option to save more drafts. I have a modern phone and have even deleted the app and re-downloaded again. What can I do to make it less buggy? And for it to stop crashing?,3,724,309.1.0.41.113,2023-12-08 08:19:40,,,309.1.0.41.113
562e59d5-46f8-4f01-94d7-84d63b9da3a7,Cara Flora,https://play-lh.googleusercontent.com/a/ACg8ocIqpYej3C4uZauHA1h0Oporm71RFRoyXYhtuVW7-R3K=mo,"Videos don't load smoothly anymore. Older reels look choppy now, even if they didn't when posted months ago, despite repeated requests to correct it. It has nothing to do w/my wifi connection or cell service. I upload high quality, and they chop it up. Glitches very often, any time they update, it ruins posts. The algorithm is not that great either. Definitely favors people who already have a super high # of followers. You could have spectacular posts, but no one will see them. Support sucks.",3,342,307.0.0.34.111,2023-11-08 01:00:24,,,307.0.0.34.111
025727ba-d8c3-49b6-a853-595771479d57,Dylan Whitney,https://play-lh.googleusercontent.com/a/ACg8ocJDWVEBTK3RaBDDMDa428Q9zTe2Jv6lPOBJ2ii0lPng=mo,"Overall I love Instagram. However I had an old account for a long time, about 2-3 years ago I got logged out of my account, and did all the steps to verify my account but they said that they couldn't give me access to it..... Okay, so I made a new one, and now it logged me out and won't let me back in, again!! I've sent an email to support three times and have heard NOTHING back. I LOVE Instagram besides it doing this!! Great app and great reels and suggestions.",5,341,309.1.0.41.113,2023-12-09 04:59:45,,,309.1.0.41.113
48342919-9e02-4bf1-8e88-a56441b6bc41,iRokr,https://play-lh.googleusercontent.com/a-/ALV-UjX13Q0QPKogbjNughz2d5pPqjrfJqEDsi-lp6Qb15TWhns,"Terrible commenting system. It only serves to promote hate and fuel anger. Old: I wish there was more control over when it refreshes/auto-scrolls to the top :/ Old: It's pretty frustrating to use. The video player functions don't really work - they also removed landscape as an option, as far as I can tell.",1,7,311.0.0.32.118,2023-12-26 21:30:24,,,311.0.0.32.118
44f27846-1089-4df6-ac8b-687972fc167a,Laura Burk,https://play-lh.googleusercontent.com/a-/ALV-UjVaA8KWV3M1orHEF8oxRnSMNUWRbaAFkyIImWiYxrIENdI,"Drafts option is constantly bugged. I'll get a post worked out & save to my drafts, only for there to be some mystery issue with the photos or videos a few days later. It won't let me delete then reattach the media, so I'm forced to delete the draft & start ALL over again. Scheduling is also NOT an option for my Creator account, even though it should be. A lot of my friends are able to schedule, & even more are also having issues! I've sent SO MANY support requests to Instagram with no answer",3,19,311.0.0.32.118,2023-12-15 11:19:03,,,311.0.0.32.118
3039958b-47b9-4cd5-ab34-d2f24d463e00,Lilian Rivera (Lilyy),https://play-lh.googleusercontent.com/a-/ALV-UjVdY9Jibtbzj4IOodFw67HDOhnRaZuaqQnPr-F14KelaEQ,"The audio on my reel is no longer available, Instagram should at least allow me to go back and edit so I can add ANY audio VS. having it silent 😔. More feedback Draft doesn't work, no matter how much your put Into it. It just force me to just upload as I go VS. keeping it saved (draft) for later. Please bring the ""fit to screen"" the zoom in option for reel. Uploaded a reel and once it was fully uploaded no matter how much I resized it, it still cropped and was not fit to screen",5,726,308.0.0.36.109,2023-11-09 16:15:13,,,308.0.0.36.109
916f3d34-f4c4-4282-bd7c-2acf8d6ded0b,Chekwube Ugwu,https://play-lh.googleusercontent.com/a/ACg8ocJAIgGTjGsZteGt0lmjPrn2jGMk7OettBs5q7icgKkw=mo,"Sometimes, my videos and pictures are upside-down, when I try to upload a video it deletes, and it freezes. Most of the times my videos are not even shown to my followers, which is very upsetting. I had an account that had more that 10k followers, but I lost it due to a phone change, IG was no help. I couldn't get my account back no matter what I did, so I had to start over.",2,5,311.0.0.32.118,2023-12-20 13:54:15,,,311.0.0.32.118
e1a8deb3-0f24-4ae0-ace9-89c9f2cac566,Ms. D,https://play-lh.googleusercontent.com/a-/ALV-UjWt_qoO_4cfTmuaiiaDy1xrmoMCkC_ayi50u3l5usudRinY,"Notification won't take me to the actual comment. Channels showing in primary. Can't filter notifications bc they freeze. Can't see what I'm typing in comments. Posts on people's pages & mine aren't visible. Says there's 100 but it's only showing like 9/13 then black below it. I can't report a problem bc it says ""error, report cannot be submitted"". Fix it please, it's all very frustrating.",2,378,308.0.0.36.109,2023-11-10 01:29:31,,,308.0.0.36.109
d6043746-56a5-4a00-a6c6-3550d246602c,Caroline,https://play-lh.googleusercontent.com/a/ACg8ocJydTWDi0GEP3uUrbLvk7lM58ARZnDYsgdYUVDFRnHL=mo,"Obviously a great platform but the updates and features added have been so inconvenient recently. Some people don't have the ""add yours"" feature, some still don't have notes, some still can't even add music to stories. For me I can't add highlights anymore and I don't have the broadcast feature despite the app being updated. Um if this is a problem on my end and not the app someone help PLEASE",3,286,308.0.0.36.109,2023-11-14 20:18:12,,,308.0.0.36.109
a1e228e7-c1bb-48f6-bede-397c5fb86dfe,Darius R,https://play-lh.googleusercontent.com/a/ACg8ocLjGbu5FA_MdCMbBkSajiqcbxNgCUnzDXW0YBTr8gfg8WU=mo,"Basic issues on Android. Buggy and does not let you remove Threads or the badge even when you click save. The back gesture swipe does not go back rather takes you outside the app (to homepage) or it gets locked in the messenger. Same with discard story which does not exit, you have to exit the app entirely and reshare. Among many other issues, like courier font style doesn't render correctly (e.g. using Farsi Gboard on Android vs iPhone yields different font styles).",1,145,307.0.0.34.111,2023-11-05 06:34:27,,,307.0.0.34.111
e5991c38-a93c-456e-93ac-65ea5eda007f,Evan Mac Giolla Rua,https://play-lh.googleusercontent.com/a/ACg8ocIp89Z4KsK3oohbl2TWHlQP-xqW3dGbCf4duTcb2UM0=mo,"It's pretty much just another version of tiktok anymore, whereas it used to be a platform for artists and photographers. If you want to pay for a sponsored ad, you'll have a better chance. But, that's the only way to actually gain followers. The most infuriating is that they keep deleting my captions, I've reached out through their ""help"" button, and it's been weeks with no reply. Highly don't recommend bothering with a creator account on here. It's just an app for mindless scrolling nowadays.",1,65,310.0.0.37.328,2023-12-11 22:57:10,,,310.0.0.37.328
6e03a4cb-e9a5-4f00-beae-116ca880b253,Edward Andrews,https://play-lh.googleusercontent.com/a-/ALV-UjWvkhk1qFpRJHUsePrLTX0muXIDu7A5r0MK4P18HeKI3A,"Instagram loads half of every video and reels in my feed instead of fully loading videos and reels one at a time. But, you want to know what never fails to load completely... ads that I'm not and will never be interested in. Why would someone want to only watch the first couple of seconds of a video or reel but opt to watch or view a full length advertisement.",1,128,306.0.0.35.109,2023-10-27 11:44:13,,,306.0.0.35.109
70693f3c-c8fa-4954-8195-d2f90237e812,3stoogesKing 123,https://play-lh.googleusercontent.com/a-/ALV-UjU16tWu4d6Jbt_b7mncGCGZexiZicloTvWMIKVMc_Sp82sR,"It's slow. The screenshare never works whenever you're on call and wanna show them reels. it's never getting better, but it's only worse. I'm honestly waiting for all media platforms to get shut down due to poor maintenance and absolutely poor quality. also, video calling is very, very glitchy and frustrating, and again, it doesn't work right",1,426,309.0.0.40.113,2023-11-21 04:26:07,,,309.0.0.40.113
