reviewId,userName,userImage,content,score,thumbsUpCount,reviewCreatedVersion,at,replyContent,repliedAt,appVersion
1c097ab4-2ab7-465e-ace8-9859cc2cfd3d,Bethany Diaz,https://play-lh.googleusercontent.com/a/ACg8ocJapWR0TCrjPWw1PhEPca6kspKaNhMo3PvP8F2tU6qdUA=mo,"This recent update has been extremely buggy. Need to refresh messages to show new ones, can't access any of my albums that are on an SD card. Tried uninstalling and reinstalling, but had yet another issue! When trying to log in to one of my accounts, Instagram kept saying in multiple ways that the account couldn't be found. Had to go through the process of recovering it, even though I was just using it before the reinstall.",1,44,313.0.0.26.328,2024-01-16 05:16:11,,,313.0.0.26.328
9b297bc8-f498-4d40-9a48-ca5e646656e2,Matthew McLarty,https://play-lh.googleusercontent.com/a-/ALV-UjU2oUeWtyJ3NHnRgkLVtWyhAh8z9ZG7-EydvW8TcKdC2Lk,"I'd rate this higher if the app would open links using Chrome instead of a window that's internal to the app. If you want to go back to the app, you have to close the link. I know that I can click and open the link in Chrome AFTER the link has already loaded. That's an extra step, uses extra data...I could go on but you get the point. Fix this issue and give me a preference where I can choose how to open links and I will update my rating. Until then, you can continue losing as revenue from me.",1,433,312.1.0.34.111,2023-12-27 03:26:29,,,312.1.0.34.111
683a0891-af91-4d8b-920e-fdbc056c2877,Justin Chapman,https://play-lh.googleusercontent.com/a-/ALV-UjU2U4cn2AsOStyXfBaPmdlbfUWzmViL2d742QGH-RekNw,"Crashing since last update, no response from support. Tried to post a reel, now it gets approximately one third the way uploaded and crashes, the app closes. It restarts when I open it and does this everytime now. I get about 45 seconds before it crashes again. Have sent multiple messages , and nothing in response. Hopefully they address this issue as it seems to be a common complaint now, and fix it... looking forward to a new update.",1,287,312.1.0.34.111,2024-01-08 06:41:48,,,312.1.0.34.111
e5f36b1c-b7e5-49f1-ba1e-e64cbef67298,Jordan W,https://play-lh.googleusercontent.com/a-/ALV-UjV6HCnA6gkQjDW2mYC20_A9TZWlmRjUoaXMcQSG3-36j-Q,"Fix the reels feature. While creating a reel the app freezes, if i make more than 5 separate text additions in the reel I cannot scroll down to edit them further as they stack. It will not allow me to save a draft, and yesterday the reel I made disappeared altogether in the ""upload"" process. Poof, gone. I'm trying to use ig to create a portfolio of my artwork and reels are no longer reliable. I've put it off but I think I'm better off making a tiktok.",2,193,312.1.0.34.111,2024-01-05 13:36:03,,,312.1.0.34.111
98912c31-7fd0-4f04-9985-809d91c52bf0,Richard Hill,https://play-lh.googleusercontent.com/a-/ALV-UjVvc6faLFg6PvALmy-f9EoXon0xJbdAdyq4U_A5SbNl6_w,"App has been broken for months - I have ""save copy to phone gallery"" disabled, yet Instagram always saves a copy to my phone no matter what. If I post multiple photos cropped for landscape, they are are distorted and post in portrait mode with very tall dimensions. The only way to fix this is to uninstall and reinstall - but even then, it only works for ONE post. I have to do it every time I want to post multiple photos. Awful, and still hasn't been fixed.",1,154,312.1.0.34.111,2023-12-24 15:11:47,,,312.1.0.34.111
7ca88c7d-e722-41c1-9464-37b30d44158a,Aliah Weiland,https://play-lh.googleusercontent.com/a-/ALV-UjX8vdYlOX6tXPtbtzaW-GrHlH84yqjAmCWmYECu_5dKQhQ,"So my issue is the new update. I don't like that it automatically scrolls down to the next video, sometimes I'm still typing things and it's very distracting when all of a sudden I hear a new video. As someone with mental problems,please fix that. My other issue is, now it's not letting me interact with about 50% of videos I come across. I can not click on anything on some videos. Not even to mute it. This app is becoming more and more horrible with each update",1,153,312.1.0.34.111,2023-12-23 02:10:34,,,312.1.0.34.111
3e4661f4-2de6-4c09-95e8-49cab44c8579,Valerie trujillo,https://play-lh.googleusercontent.com/a-/ALV-UjXJ4V_-9d9QwnS5M7Nb6hy_5ZmRiav08fkpcZ2P_NLMnII,"I have been experiencing errors left and right when trying to upload to my stories. it says ""error"" all the time when I do and it only works at times. Not to mention everytime I go on the app it says ""Cannot refresh feed"" leaving me on a blank screen to reload by swiping down. It's been pissing me off, I always have to re-do stories because they don't save or even go on my story because of an ""error"" It's annoying.",1,101,312.1.0.34.111,2023-12-31 12:29:17,,,312.1.0.34.111
270191fd-0792-4c44-a303-52f5701fb7ca,Quennie Sering (rappersmuse),https://play-lh.googleusercontent.com/a-/ALV-UjUw1osQq8Sco61xFIoQxCGOn0az3QDc6AjvJdyEBERu8A,"it's been terrible for a while now. can't use add yours stickers, can't edit reels without it crashing or somehow reverting saved changes after being uploaded, etc. a lot of these problems seem to be having for years now since whenever i search for a solution, i'll find articles dating from back in 2020 or earlier. the shift to reels in general have been awful. it's frustrating to use this app if it's not just to scroll through the feed.",3,53,312.1.0.34.111,2024-01-03 11:24:33,,,312.1.0.34.111
17024af9-7cb2-4f5b-bae6-f1aab7e9f799,Jaclyn T,https://play-lh.googleusercontent.com/a-/ALV-UjWxd50Lq-a6i_0kqmcgEk65dZ3R71rsCPrRfDKLaWZ4VQBD,"There are so many bugs, all the time. I keep running into the issue of my posts or reels not posting and getting an error message. The app constantly freezes as I'm trying to make reels. And, the Save Draft button doesn't work anymore, I have to back out and hope it saved. Sometimes it doesn't save and it gives me another error message. Very frustrating.",2,1970,313.0.0.26.328,2024-01-11 00:42:39,,,313.0.0.26.328
12e7cf3c-57b5-468f-b46d-7aa614d6e8b4,Steven George,https://play-lh.googleusercontent.com/a/ACg8ocISCtLaYyQC4PwvMbiuUQEUxQBlE0dQYxkDFquxQXLm=mo,"I enjoy photography and enhancing memories with just a few clicks. Wish the application offered more features. Like a music profile on our page,I understand they have a very visual HTML format, I feel like they could bog down some scrolling features. And definitely switch up the mutual or suggested friends could match better. Overall as far as PR and picture editing features it's A1",4,2,313.0.0.26.328,2024-01-16 20:55:12,,,313.0.0.26.328
97688cc9-d82a-45cf-9f57-442d5f5e8cfe,Gustavo Mendez,https://play-lh.googleusercontent.com/a-/ALV-UjWjpZNehfxBqqpi6HEPGiH2fg-IDl-DVluOoxmUOLxyynFI,"This is a good app, but I don't like how you can't stop posted photos from being saved to your gallery anymore like you used to. I turned off the ability to save posted photos, but it still does it. Not to mention that whenever I select a profile from a user's following list & then exit the profile of a person they follow, it sometimes takes me back to the top & I have to scroll down again which can get annoying. Please fix.",3,10,313.0.0.26.328,2024-01-16 13:53:50,,,313.0.0.26.328
63914c12-3940-4f7f-9712-c9edc6a1a219,Mary Parrott,https://play-lh.googleusercontent.com/a/ACg8ocIGEYJOIpX5w1IkTS1hsZk1uqWA1qc_H7lO_AIxKfA5=mo,"I constantly have to uninstall and then reinstall just to post a picture because it will not allow me to zoom in on a picture. When you go to edit, all pictures are the original size and not the way it was edited to. Very frustrating!!! Instagram is made by FACEBOOK right? Why then is an app designed to show off photos more difficult and less user friendly than Facebook? Facebook allows you to add more photos after you post. Please fix the issues so it is more user friendly to post a picture!",1,74,312.1.0.34.111,2023-12-28 13:04:16,,,312.1.0.34.111
2e1c4998-47d0-4c08-a09a-a3984a1f5376,Tony Diamond,https://play-lh.googleusercontent.com/a/ACg8ocKFkIu-057silLsElJN8Dyjqq4PuNguzJ9OvwLk2XgC=mo,"It's become absolutely awful. You take the time to find a song for a reel, you find the perfect song, you edit the video add effects and sounds. Then you spend some time to come up with the perfect title, youre done! You post the reel, 30 second later you get a notification ""you don't have permission to use this music from :: insert media company ::"" Why is the song in available for me to choose on the first dang place!",1,1300,313.0.0.26.328,2024-01-12 06:26:12,,,313.0.0.26.328
2732525e-b44d-4a99-a00e-e99b48d8f1f8,Markeia,https://play-lh.googleusercontent.com/a-/ALV-UjXCYBirSDEQ9N8VNtQzAU_PsapkllGuCsqf_B2lKYEOg74,"This has been my second least fave social app for a long time due to bugs. It's always difficult to post (bc editing will make pics have weird framing, so can only post never edit in app) Ever since I updated this year it's impossible for me to FIND my recently taken photos (I've searched in every album listed in IG). Not only that but it's like it randomly chooses what photos (including downloads) will even show up for me to post. It's infuriating and very frustrating. I wish I'd never updated",1,3,313.0.0.26.328,2024-01-16 03:42:53,,,313.0.0.26.328
0d0818a7-e910-4e8b-a249-a566724f5610,Audrey Thornton,https://play-lh.googleusercontent.com/a-/ALV-UjVOjTDwPr7ZO9ule6s4MsvfyoyIq-a6bd6q6GnncwlHY68,"Mostly ok. Lately the app has been loading wrong. My phone icons are layered in with the IG icons so I can't use the app properly. Tried uninstalling and reinstalling but the issue continues. 1/14/24 edit - for the last two days, IG doesn't recognize the latest photos on my phone. Tried deleting and restarting the app. Nada. Tried turning the whole phone off/on. Still nada. Disappointed!",4,18,313.0.0.26.328,2024-01-15 00:33:31,,,313.0.0.26.328
5ec7cb92-7188-4ff6-9aef-f617185f42c6,Brianne Giddis,https://play-lh.googleusercontent.com/a-/ALV-UjWzaVuDJMCKSQH0GCGWYukULkit5NYXT4s6TkHXXBcQgYFx,"I use this app all the time, but recently (within the last week) the app is no longer able to find the photos I have saved to my SD card. These photos are still available in my phone's gallery, I just can't post them to instagram because they don't show up in the gallery instragram creates from the photos on my device. I have tried clearing the app's cache, restarting my phone, making sure 'data saver' mode is off. Nothing fixes this. This review would be 5 stars if not for this issue.",1,2,313.0.0.26.328,2024-01-16 04:18:32,,,313.0.0.26.328
18766631-7286-4a97-8b51-5fd13cae3b2f,evian3535,https://play-lh.googleusercontent.com/a-/ALV-UjVpBB0EZMkcs6xL-McEnS92PLvY-iRQqQVYeXLbnbMkI_o,"Can't post camera photos to feed! Open app, click the plus sign to add photo(s), and nothing I've stored to my camera album shows up! The only way I can post from that album, is through the share option directly from the photo when I open it from the gallery first. This is fine for when I'm just wanting to post a single photo, but I can not share multiple photos to one post this way, so I'm stuck sharing camera pics one at time, one pic per post. The issue just started within the last few days!",2,97,313.0.0.26.328,2024-01-14 15:48:08,,,313.0.0.26.328
23f39596-5fdf-4f5e-83e5-b5b69f6dbb0a,Jeremy Watkins,https://play-lh.googleusercontent.com/a-/ALV-UjVDk8TDchDKUxKkMpSBxOmAFfkQFMv9X5gZPCObNTj2fvYP,"The ""save"" menu that pops up is a great addition to let us choose which save folder to use, but it'd be nice if it were less prominent. It covers most of the screen, but if I want to quickly save a video and move on without picking a folder, it gets in the way. Maybe a smaller menu would be better. Removing a star because now anytime I take a screenshot it's ""dimmed"" or really dark. This only happens with Instagram, no other apps.",3,2316,312.1.0.34.111,2024-01-07 05:41:28,,,312.1.0.34.111
1213639e-9a12-4699-8f31-928727e4c12c,Electric Elephant,https://play-lh.googleusercontent.com/a-/ALV-UjVw7f6rJC6pMOXGi4LeGvFHexVELt9tRChewt6Mmp12B_4,"Been trying to do a post just with horizontal, zoomed out pictures (3 to be precise), but the moment I go to the next page (effects) all the pictures have been changed to the vertical zoomed in format and after that I can't change them back anymore. The post just gets made with cropped, vertical zoomed in versions of the ones I wanted to do. Don't know how or when this gets fixed, but as a photographer and painter making a living out of this app, it is a total nightmare to post pictures. 0/10",1,40,312.1.0.34.111,2023-12-22 07:42:21,,,312.1.0.34.111
63ee14a1-3f3b-4a6f-b54a-58d86211b259,Clancyman2012,https://play-lh.googleusercontent.com/a-/ALV-UjXMOIPXnGvC7H8bawUV37_q9pMMZQXUASfmGerE043Kbw,"I really like the app, but the latest update is garbage. I hate the new look. Placing the ""home, search, profile, etc"" buttons on the left side of the screen was a poor choice. I have hit one of those buttons unintentionally as I went to scroll through my timeline several times. It also makes the app look like cluttered placing them on the side. Put the buttons back on the bottom.",1,172,312.1.0.34.111,2023-12-21 21:47:43,,,312.1.0.34.111
d1d2715d-fadb-4614-86e9-dcf8679c5682,Jess Gonzalez,https://play-lh.googleusercontent.com/a-/ALV-UjUpVzGf-IkGiCHRSSgViNK6R6-9JezH_9tBxmUqti16Gzk,"Came to see if I was the only one having issues logging in. Turns out I'm not! I was trying to switch from one account to another but I just get a blank screen whenever I try to open the app. Can't log in at all anymore! Edit: I posted this review ages ago, but most bug fixes have improved the app overall. Would love to be able to pause reels.",4,52,312.1.0.34.111,2023-12-22 21:07:33,,,312.1.0.34.111
155cb130-f61d-4b0a-ae41-112bf8d9274d,Allen Shelton,https://play-lh.googleusercontent.com/a/ACg8ocKF_gJv3l_PYCgaAdUfIAsrRRZYXIB-tvnqt8Z8rWiJ=mo,"Within the last few week, I have not been able to upload video or reels. I've cleared the cache, restarted the phone, uninstalled and reinstalled the app and it still won't allow me to post a reel. It tells me to try again, which I do, and it tells me that the upload failed. Articles online tell me to check my internet connection, which is fine. I've even turned off and re-enabled Wi-Fi. Logged in/out. I tried it all. I still can't upload any sort of video.",1,62,312.1.0.34.111,2023-12-24 19:59:21,,,312.1.0.34.111
1236bf97-8396-4124-a6cb-c03b0e01a502,Tiffany Luman,https://play-lh.googleusercontent.com/a-/ALV-UjVm_VCT60tX30RCx4ii6vIpmE4kCqik0XQ2VS9WhLuebiA,"I've been using this app for years. Never in my life have I seen an app with this many bugs. First off, I can't even save pictures on insta I have to post them to my story to save them. Alot of my story archives just say December 31st, 1969. EDIT: Yall just took a feature away from me. I'm a public account. I'm so fed up. Edit 2: the issues still haven't been fixed. EDIT 3: I can't post on my story without the app closing, like I open the camera and it crashes. Another main feature I can't use.",1,46,312.1.0.34.111,2023-12-21 05:23:02,,,312.1.0.34.111
a74a68d6-5b48-4be1-a6a1-de584eebdf39,Penguin hehe,https://play-lh.googleusercontent.com/a-/ALV-UjWSgIqXauzYIgaVoqmHquEinCimC1ahKoM98Sb5M4D9nF4,"The first review I did on insta's glitch problem was two years ago, and insta never fails to still have the same--and actually more--problems occurring. Insta should start fixing the fyp glitch; error in processing likes, comments, and saves; reels and highlights randomly not loading; etc. Please fix them... we know you're modifying the layout, but I don't even get notifications now...",1,2,313.0.0.26.328,2024-01-16 12:30:53,,,313.0.0.26.328
25ef4518-83ec-4725-9c66-ac1b1eafca8b,Space Hoodie,https://play-lh.googleusercontent.com/a-/ALV-UjV2dJG00rvUgl6X2ew1SogdHbcpU6ZpWgyZCSNaJ1GU3A,App is fine sometimes but has alot of problems. Currently wont let me open comments or like or shar videos. I can tap on them with a clean screen and all but it doesn't register. I cant make reels on the app anymore and have to upload them from a editing app. Audios will delete or freeze over and keep playing if i close the app or try to uplaod a new reel. Its annoying how bugs will get 'fixed' but then theres always new ones.,1,12,313.0.0.26.328,2024-01-15 02:51:17,,,313.0.0.26.328
0a13fdd8-c91d-4e36-993c-eae0217f2f31,Danielle Piñon,https://play-lh.googleusercontent.com/a-/ALV-UjV3UyMKT_tVzYnNsIIQhsOh8sJW7MRCflrvfZmDSi38BOZq,"It always shows there's a message request in my inbox, when there's no message. To rectify this, I have to go in and delete ALL the messages in my inbox. Often I have to go back to conversations i had YEARS ago to fix it. Then it happens again out of nowhere Update: this is STILL an issue a year later Update 2: LET ME TURN OFF AUTO SCROLL OMG Update 3: I just installed it in a new phone and it freezes. Can't tap on anything, so i have to close the app and reopen it for it to work.",2,641,312.1.0.34.111,2024-01-04 00:53:42,,,312.1.0.34.111
ded4df7c-351b-4c2c-849b-6a0c4bf44357,Lyssa Roman,https://play-lh.googleusercontent.com/a-/ALV-UjWywLJvk1VFsaW_RTdU7J3P_1rIJte4Grp8RbdEKv8Ooos,"It's OK for the most part, but I've recently been experiencing a problem where eventually the app will only show comments from previous reels on new reels while scrolling. It also does this thing where it will only open the comments no matter where I touch my screen and won't let me like any videos. I cleared the catche on my phone, then deleted and reinstalled the app, but it's still not fixed. Idk why it's doing this but it's really annoying.",1,51,312.1.0.34.111,2023-12-25 12:41:57,,,312.1.0.34.111
d70e4e1d-048e-48f2-9b66-8e2eba30b47a,Ariadna Herrera,https://play-lh.googleusercontent.com/a-/ALV-UjWR_wIP3rFMEeqYY3nSV3x3GcQWKG3X43cA9Fd89DukoEE,"This app has truly taken a turn for the worse- and repeatedly. I wish we could make the chronological timeline that's composed of just people you follow the default (you know, how it used to be ages ago!). I also don't want to see suggested threads. I'm not interested in that app nor in seeing any of it's content. All of this mixed in with the insanely high number of ads just makes this app so incredibly unfriendly towards users and makes curating what you see near impossible.",1,65,312.1.0.34.111,2023-12-24 09:31:42,,,312.1.0.34.111
90fae2a2-12b5-4e78-a1e9-4b8aa6d5780d,Ezio Auditore,https://play-lh.googleusercontent.com/a-/ALV-UjWrDh_2pcsjFDTnt6GMDOo816UlTYjYkqo43pg78GJF7HO5,"If You're Wondering If It's your phone, it is not your phone.After the Android 14 Update for My S23, it keeps freezing up til you close the app,messages won't show up unless you close the app and go to the chat, back out, and back in again. And so many more issues with stability. Honestly, I'm going to switch over to a different platform to text people at this point.",1,4,313.0.0.26.328,2024-01-14 22:46:28,,,313.0.0.26.328
6dadff96-07fa-492a-a760-c06a9113bad6,Hollis Branham,https://play-lh.googleusercontent.com/a/ACg8ocJF8IgwvbhnOviNbuhMWjr_ulwli4rpw_raj_UeoviB=mo,Please undo this latest update. Moving the home bar to the left side of the screen for tanlets was a very bad idea..it shrinks the size of the picture or video we're looking at there's no improvement at all with this change. It's like you guys just randomly switch stuff around just because..there was nothing wrong with the way it was before please change it back.,2,104,312.1.0.34.111,2023-12-25 10:20:47,,,312.1.0.34.111
960a7397-2aee-4f14-94e7-601c9c99b605,Starfy,https://play-lh.googleusercontent.com/a-/ALV-UjWhru8R6s_r6b9xkzZrRyt7YOes-BS--sHnpKWAenf5kA,"This app enjoys gatekeeping its features from people, and it's how it sounds, only a specific amount of people will have said features for the app. I've been waiting two months for me to receive the feature of editing direct messages, even after unistalling 3 times. If they are still testing this feature, at least give the option in the settings to enable it, if it's any bothersome.",3,72,312.1.0.34.111,2023-12-31 10:14:33,,,312.1.0.34.111
3d78b577-f19d-4332-abd0-1e67b2bc89f2,Jesse Selesky,https://play-lh.googleusercontent.com/a/ACg8ocJLnS38A76kaPe7p7q6PRtOSYga0FcQyo_HgrZ2ZFmb=mo,"Instagram allowed logins from multiple devices from multiple countries on my account, yet when I try to log in to reset my password, I'm somehow the one that is being denied access at every corner. Error this, code expired that. They don't even have a button to press to contact support when they give you an email saying ""Your account is being accessed from all over the world, tough luck"". If you value your privacy/ don't want random people easily getting into your account, skip Instagram.",1,47,312.1.0.34.111,2024-01-08 14:37:17,,,312.1.0.34.111
0366e040-a7ec-41e7-858d-a01327842a7a,David Curtis,https://play-lh.googleusercontent.com/a/ACg8ocLGXn8gsi1zf-eCP2VOx2riTz4E2k-7g88uEjcKS2jN=mo,Most recent up lost the apps ability to see my picture albums which are stored on a separate SD card. Can no longer post to my feed. Have almost 1600 posts to my feed with around 10k images posted. Had posted the day before the last update. A previous update last year lost access to my albums when posting add to yours in the stories. Kind of makes it hard for me to share my photos. 1.11.24. Tried uninstalling and reinstalled 3 times. No joy. It doesn't even see pictures I took earlier today.,1,376,313.0.0.26.328,2024-01-12 08:19:11,,,313.0.0.26.328
655df773-f759-4e5e-82aa-9ad290f859fa,Puppy,https://play-lh.googleusercontent.com/a-/ALV-UjWXfg8w9o-MTJn9jlZ6CRA3mW0jGu2ilVDQEkIwEIn2K3E,"This app is utterly destroyed. For months I have been experiencing random glitches, but recently it has gotten extremely bad. The feed is broken, I no longer get suggested content, I rarely ever get more than three posts before having to refresh to see old posts. My messages will vanish, not only the message, but now the actual chat itself. I have reinstalled the app to no avail. Instagram is part of the largest Social Network, it is a disappointment that they cant fix the bugs in their service.",1,35,312.1.0.34.111,2024-01-01 15:05:31,,,312.1.0.34.111
7df8391f-76d7-4cb5-95ab-9410d35a54ae,Dasia L,https://play-lh.googleusercontent.com/a-/ALV-UjX5ebAyvhmoZX4jR_seL6tRE7cyKfYtwLUqpTOHIr3Pmesw,"Whenever i am watching reels (scrolling down liking whatever) its like the screen doesn't recognize me tapping on it. Its every other video. I cracked my phone screen a few months back so I thought it was the phone. Nope. I switched to my old phone and it does the same thing. It doesn't let me like, or tap comments on certain videos, I have to swipe out the app and other apps to go and he able to like it",2,5,313.0.0.26.328,2024-01-15 07:10:12,,,313.0.0.26.328
d48680e9-baf9-468d-976b-b15df2d95b12,patinece dobos (spring chicken),https://play-lh.googleusercontent.com/a-/ALV-UjU7akpG2aa1Z8ERX6ahO1puQpbjtcxN-1bawBLz40-W8TQ,"Instagram sucks, I can't schedule posts, when I've tried to contact support or get the problem fixed no response( I've tried multiple times) insta regularly deletes the captions on my reels, won't let me get rid of drafts except posting them and recently when editing a reel the audio disappeared, couldn't edit placement of text and if I clicked to change the words it made my phone buzz nonstop. I'm not going to mention algorithm much but I know it has not been the kindest to some including me.",1,61,312.1.0.34.111,2023-12-31 08:46:34,,,312.1.0.34.111
adaedeed-06b2-47df-868e-c5e5d00b222b,Courtnie P,https://play-lh.googleusercontent.com/a/ACg8ocJw6AbQ_UstdKxlQ14JaYkhE9Fmr7mPZoiGHF4jEUb5=mo,"When I try to share a note, it doesn't let me put music on the note, then when I try to view other people's notes, the song either isnt there, or it says ""song isnt available in your country "". Then when I try to click the more info button, it just goes away. I tried restarting the app and the phone but it just doesn't go away. Please fix it Instagram!!!",2,45,312.1.0.34.111,2023-12-30 07:31:06,,,312.1.0.34.111
0ac30dfe-9c9e-4c17-9714-389ed11e23de,Jessica L Townshend,https://play-lh.googleusercontent.com/a-/ALV-UjXVxaCfKxk4_1bh1wBfszN-pUWHY2gU9E7k89ij_3Ig_fMb,"The latest updates have a bug where Android users are unable to access any media stored on the SD card. This is incredibly frustrating and makes using the app to upload anything of my own nearly impossible. This bug has been going on for two weeks and should have been fixed by now. They need to make it usable for everyone, regardless of device.",1,148,313.0.0.26.328,2024-01-13 03:12:16,,,313.0.0.26.328
43f62192-b94a-45e4-9ec5-0c2d055fafbf,Angel Santay,https://play-lh.googleusercontent.com/a-/ALV-UjWIa2zXr-DZ2TglXBO1wLzwbHB1VRLkamR4qpDxVCfur9c,I've been using the app for years but recently my android device has a problem staying in dark mode completely after I exit and try to open the app again. The screen has pieces of the app that are white while it's in dark mode. Sometimes it causes the text boxes to turn white which leads to me not being able to read the white lettering very well. I use this app all the time I like it a lot it's just that dark mode that's getting annoying.,3,30,312.1.0.34.111,2024-01-07 09:36:14,,,312.1.0.34.111
d316e472-9e6d-4e20-a1c0-afa3c7d76750,chad smith,https://play-lh.googleusercontent.com/a/ACg8ocKpWiJjhBcnbHCq8gsJb0kXJC4aovxsEcZfVNx6OV36=mo,"This app still needs alot of improvement. They will literally downgrade the quality of your videos on reels for no reason at all! Same with picture reels. They are not the same quality as just a regular post! Also randomly zooms in your photos just a lil bit, throwing all good angles off completely! It's not fair because you don't get what you posted. You get a slightly lesser quality, zoomed in picture that's now a different angle than what you posted!",3,370,313.0.0.26.328,2024-01-15 10:21:57,,,313.0.0.26.328
